"appId","currency","developer","free","icon","price","score","scoreText","searchTerm","summary","title","url"
"daily.planner.routine.habits","USD","ENERJOY PTE. LTD.","true","https://play-lh.googleusercontent.com/yLzk8Pcr5eTLD0vRfFCmnEMnTmQqe9kuoturzN4Klu24C7z6lyZV2TCgGuuUOSYNzkk","0","4.877338","4.9","lifestyle","“We are what we repeatedly do. Excellence, then, is not an act but a habit”, This quote from Aristotle goes to the heart of our philosophy. We believe establishing good daily habits and healthy routines are necessary to thrive. This is what we aim to achieve: to help our users develop good habits and daily routines, like following a morning exercise routine or tidying their rooms, and to consistently repeat those actions until they become habits integrated into their lifestyle. This will enable people to lead a wholesome and fulfilling life.<br><br>Of course, accessibility is important. This is why Me+ now provides a daily routine planner and self-care schedule to establish a healthy habit and help with your daily routine. By repeating good actions daily and following your planner and self-care schedule through an everyday to-do list, you will gain a new outlook, confidence, and strength. Obstacles that seemed unsurpassable will soon be overcome and forgotten.<br><br>Enjoy and utilize our self-care systems:<br>· Daily Routine Planner and Habit Tracker<br>· Mood and Progress Tracker<br><br>The systems in our app make it easier to seize the day and begin self-development by planning your daily routines and habits. It provides a to-do list to follow.<br><br>Here are some great things you can do with the new daily routine features:<br>-Create your own daily and morning routines.<br>-Track your self-care plan, daily habits, mood, and progress daily.<br>-Set friendly reminders in your daily planner for your to-do list.<br>-Get comprehensive evidence-based self-care information on establishing habits and healthy routines.<br><br>Potential benefits of Me+:<br>-Boosts energy: Exercise, healthy eating, and sleep habits in your Me+ daily planner energize your body and provide motivation for self-care.<br>-Improves mood: relieve stress and increase happiness through your daily healthy habits and routines.<br>-Slows aging: Long-term daily self-care habits and routines are the best way to maintain youth.<br>-Increases focus: Sleep habits and nutritious food improve your concentration, productivity, and motivation.<br><br>Build your own self-care schedule and daily routine planner with the icons and colors you choose! Record your daily goals, habits, mood, and more in your Me+ app to celebrate the success and growth of your healthy routines!<br><br>HOW TO START SELF-CARE:<br>-Use the professional Me+ planning template and daily habit tracker: Take the MBTI test to find the routine and habits that suit you best.<br>-Find a role model: Set a goal to become the person you aspire to be through developing habits and daily self-care routines<br><br>Tens of millions of self-care advocates choose Me+ to improve physical and mental health, promote weight loss, experience anti-aging benefits, and more through developing healthy daily habits and self-care routines. Fill your days with self-care habits and meet your best self! Don’t wait for tomorrow; start your healthy routines today!","Me+ Lifestyle Routine","https://play.google.com/store/apps/details?id=daily.planner.routine.habits"
"com.gmail.aaravvispute.lifestyle","USD","Aarav Vispute","true","https://play-lh.googleusercontent.com/XTJRepcIDMzaUsJaD1_zE1lvG16uQjAnNkGVKyHgYDaxnRcrFBJ6uTRrplZhNlc9Zqo","0",,,"lifestyle","Embrace a healthier, more sustainable lifestyle with the Lifestyle app!<br><br>Our app empowers you to make informed choices for your well-being and the environment. Track your water usage during showers and receive a personalized rating to optimize your water consumption. Celebrate your progress with rewards and certificates you can proudly display.<br><br>Stay on top of your health with our BMI calculator, which provides valuable insights into your body composition. Additional health features are on the way, ensuring your journey towards a healthier lifestyle is supported every step of the way.<br><br>Enjoy a clutter-free experience with our user-friendly interface and the absence of annoying ads. Embrace a lifestyle that prioritizes sustainability, well-being, and ease of use with the Lifestyle app.","Lifestyle","https://play.google.com/store/apps/details?id=com.gmail.aaravvispute.lifestyle"
"com.threedlifestyle","USD","3D Lifestyle","true","https://play-lh.googleusercontent.com/J8-kDBNqQKym5gEFNWNolo03YgYtJBiVgXj-pSPb4g8F6ilyjWqQnZiaF-DuDa1VuWQ","0","0","0.0","lifestyle","3D Lifestyle is providing FDA-approved non-surgical aesthetic treatments, including body contouring, laser hair removal, and facial.                                                                                                                                   Book Appointments and Get Amazing Offers &amp; Discounts Now With a Single TAP!<br><br>Skincare is more accessible now with 3D Lifestyle Mobile Application. It’s a one-stop solution to all your skin and health care needs. Book an appointment without any hassle and get ready to avail amazing offers &amp; discounts. <br><br>Experience the best features like:<br><br>⦿ Online Appointment Booking<br>⦿ Book your appointments at your nearest 3D Lifestyle Clinic<br>⦿ Get Reminders for Appointments<br>⦿ Request for Rescheduling Appointments<br>⦿ Avail Amazing Discounts and Offers<br>⦿ Get hands-on Exclusive Treatment Packages<br>⦿ Online Payments &amp; My Wallet Feature <br>⦿ Feedback and Complaints<br>⦿ Get in touch with your Treatments Doctors<br>⦿ Online Video Consultation with your Treatments Doctors<br>⦿ Avail Cosmetic Products Sold online<br>⦿ Refer your friends and family members to 3D Lifestyle and WIN Referral Bonus.<br>⦿ Get insights of your previous appointments and consultation.<br>⦿ Online submission of Reports and Labs","3D Lifestyle PK","https://play.google.com/store/apps/details?id=com.threedlifestyle"
"com.theslashapp.twa","USD","The Slash Discount App","true","https://play-lh.googleusercontent.com/XVLKqNEahi4z9WTmy9faUtZx0yCBq8UxOO_L3LGgkIsdZVAhj8SI7xz48uFTpRW0NkE","0",,,"lifestyle","We are a Lifestyle app for Koh Samui which includes 100s of discounts, up to date events, information guide, geo location and a whole lot more!<br><br>Explore Koh Samui easily whether you are traveling solo, as a group or  ad a family we have your whole holiday covered","Slash Lifestyle","https://play.google.com/store/apps/details?id=com.theslashapp.twa"
"com.zagalaga.keeptrack","USD","Zagalaga","true","https://play-lh.googleusercontent.com/TUbO2xs6UJ9ELmx9rkm88YCiHPDFoC5tKSRwwGm5kCyW6Mx6Gr8KCdkDkh79tULS6mM","0","3.76","3.8","lifestyle","chrono.me is a logging app that allows you to keep up to date on every factor of your life! Log information such as weight, medical status, sport activities, or anything else you can think of. Use the app to visualize and get insights from it over time.<br><br>Free Features:<br><br>• Highly customizable, you can tailor your data to meet your own needs.<br>• Organize and categorize your information by using groups and tags.<br>• You can log in your data through chrono.me’s input screen and reminders.<br>• Modern UI with dark theme option.<br>• No ads.<br>• Offline mode for privacy protection. <br>• View your current stats with our customizable dashboard.<br>• Use line and pie charts, a calendar view, statistics, and other tools to analyze your data.<br>• Simple data aggregation for daily, weekly, and monthly stats.<br>• Export and import your data.<br>• Available on web and for iPhone<br><br>Pro Features:<br><br>• Unlimited tracking – track more than 10 parameters simultaneously.<br>• Set goals – define and monitor goals using your logged data.<br>• More charts - comprehensive data overviews + bar charts for in-depth analysis.<br>• Screen Widgets - access information without opening up the app!<br><br>We’re always happy to help! Send us an email at contact@zagalaga.com if you have any questions, comments, or suggestions for improving chrono.me.<br><br>For detailed information on how chrono.me protects and uses the data provided, please visit our <a>privacy page</a> and <a>terms of service</a>.","chrono.me - Lifestyle tracker","https://play.google.com/store/apps/details?id=com.zagalaga.keeptrack"
"com.saralifestyle","USD","SaRa Lifestyle Ltd.","true","https://play-lh.googleusercontent.com/kLOMuBlWwR1I0Wpxk6J3x2dXRf8uxBKrvrN8Cq_FctrLhqEH4wdMpji6lw5LmrOzv2hc","0",,,"lifestyle","SaRa Lifestyle Ltd. (sister concern of Snowtex Group ) is a well-known clothing brand in Bangladesh that has changed how people think about fashion and shopping. With its innovative and user-friendly mobile app, SaRa offers wide range of premium clothing for men, women and kids. Discover trendy collections, traditional wear and exclusive designs tailored for every occasion. SaRa offers premium-quality products at affordable prices, making fashion accessible to everyone without compromising on their budget.<br><br>Key Features of SaRa Lifestyle Ltd. Mobile App:<br><br>1. Premium Clothing for Every Occasion<br>SaRa Lifestyle Ltd. takes pride in offering a wide range of premium clothing that caters to everyone. Whether you’re looking for traditional attire, trendy casual wear, or exclusive designs for special occasions, SaRa has it all. The app allows you to browse collections designed to meet the diverse fashion needs of customers:<br><br>Men’s Collection: Stylish formal wear, casual outfits and traditional clothing.<br><br>Women’s Collection: Elegant sarees, ethnic and fashionable western wear.<br><br>Kid’s Collection: Comfortable, trendy, and durable clothing for children of all ages.<br><br>SaRa ensures that every product is made with high-quality materials, offering unmatched comfort and durability.<br><br>2. DHEU – The Sub-brand for Western Fashion<br><br>Catering to the modern and fashion-savvy customer, SaRa Lifestyle Ltd. introduces DHEU, a sub-brand dedicated to western clothing. DHEU brings contemporary designs, stylish cuts, and vibrant colors, perfect for individuals who love to experiment with their looks. The DHEU collection includes:<br><br>Trendy tops, shirts, and Midi Dress.<br>Comfortable jeans, trousers, and skirts.<br>Unique accessories to match your western wardrobe.<br><br>3. Multivendor Marketplace<br><br>SaRa Lifestyle Ltd. goes beyond clothing and introduces a multivendor marketplace. This feature allows customers to shop for a wide range of authentic products from various categories, all in one place. The marketplace includes:<br><br>Electronics: Smartphones, gadgets, home appliances and more.<br>Lifestyle Products: Home decor, trimmer &amp; shaver, watches and more.<br>Fashion Accessories: Bags, shoes, wallet, and other stylish add-ons.<br><br>By collaborating with trusted vendors, SaRa ensures that every product offered on the platform is authentic and meets high-quality standards.<br><br>4. Seamless User Experience<br><br>The SaRa Lifestyle mobile app is designed to provide a seamless and hassle-free shopping experience. <br><br>Key features include:<br><br>Intuitive Navigation: Easily browse through categories and collections.<br><br>Secure Payment Options: SaRa prioritizes customer safety and convenience by offering multiple secure payment methods (COD, bKash, Debit &amp; Credit Card Payments).<br><br>Nationwide Fast Home Delivery:  SaRa offers nationwide fast home delivery, making it possible for customers from all corners of Bangladesh to receive their orders at their doorstep. <br><br>5. Regular Updates on New Arrivals and Offers: Stay updated with the latest trends and deals through the SaRa mobile app.<br>Discover new arrivals as soon as they launch.<br>Get notifications about exclusive sales, discounts, and promotions.<br><br>Enjoy special deals during holidays and festive seasons.<br><br>6. Customer Support<br><br>SaRa values its customers and offers dedicated support to address any queries or concerns. The responsive support team ensures that every customer’s issue is resolved promptly.<br>Why Choose SaRa Lifestyle Ltd. Mobile App?<br><br>Convenience: Shop anytime, anywhere, with a few taps on your phone.<br>Variety: Access a diverse range of products, from clothing to electronics.<br>Affordability: Enjoy premium products at budget-friendly prices.<br>Trustworthy: With years of experience and a loyal customer base, SaRa is a brand you can rely on.<br><br>SaRa Lifestyle Ltd. is more than just a clothing brand; it’s a one-stop solution for all your lifestyle needs. Download the app today and embark on a shopping journey like never before!","SaRa Lifestyle Ltd.","https://play.google.com/store/apps/details?id=com.saralifestyle"
"co.thefabulous.app","USD","TheFabulous","true","https://play-lh.googleusercontent.com/8LcZqMnR6O5GhCMSmH2AC06gucX-PDIxwaui_ICMs44IJXSUO8w7-Fr3eLYw8xfZ2Q4","0","4.1691666","4.2","lifestyle","Welcome to the world of Fabulous. Unlock the power of habits and routines. Prioritize your mental health, build healthy habits and improve your life one step at a time. Fabulous started as a habit tracker, but it evolved into self-improvement, coaching, and mental health platform. Our goal is to make healthy routines an inseparable part of your life. Take care of yourself and be the driver of your lifestyle change with Fabulous!<br><br>- How does Fabulous work?<br>1 - Add structure to your life - Improve your life with a healthy morning routine that provides a system for your everyday life.<br>2 - Create healthy habits - Use a daily planner to remember important tasks. Your habits sculpt the person you will become — choose them wisely.<br>3 - Focus on deep work - Learn how to tune out all the noise and concentrate on the task at hand. <br>4 - Join a community - Live challenges will introduce you to other Fabulous members from around the world embarking on the same journey as you. Find motivation connecting with hundreds of members all across the globe. <br>5 - Learn how to be grateful - Keep your gratitude journal and listen to positive daily affirmations. <br><br>Fabulous is an all-in-one routine &amp; self-care app for everyday life:<br>– Listen to daily coachings<br>– Write your to-do list <br>– Journal your thoughts<br>– Do short workouts and breathing exercises<br>– Listen to daily affirmations and meditation sessions<br>– Keep your gratitude journal<br>– Monitor your mental wellbeing<br>– Use the goal-tracker to monitor progress<br> <br>Upgrade your planner for exciting additional features that will take the habit tracking to a new level. Achieve your health and productivity goals today with science-proven features:<br>– Coaching series grouped by topics: anxiety, self-love, productivity, or depression.<br>– Unlimited habits for your morning and evening routines.<br>– New Premium Journeys for better mental health, self-care, and fitness.<br>– Personal one-on-one coaching for better motivation and focus.<br> <br>Top 4 reasons to try the Fabulous app: <br>1 - Need the motivation to build an indestructible morning routine?<br>2 - Have an irregular sleep cycle and want to learn how to get a good sleep?<br>3 - Want to increase your energy level so you focus the entire day?<br>4 - Want to improve your mental health through mindfulness so you can cope with anxiety?<br><br><br>Fabulous is recognized by top mental health experts, behavioral scientists, coaches, and, most importantly, our members. Scientifically proven, morning routines are essential to a successful life. No excuses! Start changing your life today and save money using behavioral science. Install Fabulous to get personalized daily habits and achieve your goals. Build and track your habits, set goals, learn how to meditate, and build healthy routines. Your journey to self-improvement and better mental health starts today!<br><br>If you have any questions, visit our website at www.thefabulous.co and click &quot;Contact Us&quot; at the bottom of the page.<br><br><i>This day will come and go. That much is certain.<br>Making it count? Well, that&#39;s up to you!</i>","Fabulous Daily Routine Planner","https://play.google.com/store/apps/details?id=co.thefabulous.app"
"com.llmobile","USD","Legacy Lifestyle.","true","https://play-lh.googleusercontent.com/uDQYvyKK9rQrcZBiXeTjV9ZbsKhDyhqs4vmzaOjFkEun2UdUFNVE7a-FyEwm56cAkzA","0",,,"lifestyle","Create and manage your Legacy Lifestyle account, for free, from your phone. Access exclusive Rewards, offers and privileges at over 250 Partners, across 18 categories, nationwide.<br>• Earn or Spend Lifestyle Rands online and in-store<br>• Convert Lifestyle Rands to Dis-Chem Benefit Points<br>• Convert Nedbank Greenbacks to Lifestyle Rands<br>• Buy digital vouchers to spend online and in-store at Partners across the country<br>• Manage your transactions and view your transaction history<br>• Keep your account up-to-date<br>• Find a Legacy Lifestyle Partner near you<br>• Keep track of our latest promotions and competitions<br>• And much more","Legacy Lifestyle Rewards","https://play.google.com/store/apps/details?id=com.llmobile"
"com.bd.nproject","USD","TikTok Pte. Ltd.","true","https://play-lh.googleusercontent.com/yJ-OQXxKh_5pwKRL9JuVTk727AFkpoB04T4tkz6TumKeGLapXLwAKparhsepS_bIlOFQ","0","4.7070355","4.7","lifestyle","Lemon8 is a lifestyle community focused app powered by TikTok, where you can discover and share authentic content on a variety of topics such as beauty, fashion, travel, food, and more. You can edit and share photos with great ease and engage in discussion with like-minded people. Lemon8 offers a space where you can connect, inspire, and support one another.<br><br>[Find Your Community]<br>- Lemon8&#39;s customized content is specifically made for you. Our &quot;For You&quot; section recommends a personalized feed to you based on your interests. <br>- Lemon8 is also a great place for you to express and engage in a free space with other like-minded creatives within the community.<br><br>[Create with Ease]<br>- Fed up of the faff of creating on one app, editing on another, posting on yet one more? With Lemon8, our in-app suite allows you to compose texts, edit photos and videos with ease.<br>- You&#39;ll find a whole library of intuitive templates, stickers, filters and fonts for your photos and videos.<br>- Say &#39;goodbye&#39; to jumping between apps to make a single post and, say &#39;hello&#39; to Lemon8!<br><br>[Explore and Discover]<br>- Use hashtags! Our hashtags not only help your posts get discovered, but also help you easily discover content you like.<br>- Our campaign features and intuitive search helps you find trending content, top-performing creators and whatever answer you&#39;re browsing for.<br><br>[Contact Us]<br>- We want to build Lemon8 into the app you need and desire. Your suggestions make Lemon8 better.<br>- If you have any feedback, questions or concerns, contact us at any time using the following email: contact@lemon8-app.com","Lemon8 - Lifestyle Community","https://play.google.com/store/apps/details?id=com.bd.nproject"
"com.azularc.chyropractic","USD","My Lifestyle iQ","true","https://play-lh.googleusercontent.com/JMvf2UgM8pg9iyqboSJUayt2aXT-FDCZR3B4n9AozXhixtSZpkBnU9Ww57BU-Mds8w","0",,,"lifestyle","My Lifestyle iQ is a content rich Remote Patient Management app that allows you to manage critical areas of health and prevention. It is self-directed, but is also used by doctors to enhance your in-office care by integrating multiple domains including exercise, nutrition, brain health, positive psychology and the 6 areas of functional preventative health.<br><br>MLiQ provides practical programs in 20+ areas including Weight Loss, Pre-diabetic protocols, Gut Restoration, Fatigue, Long Haul Covid, Stress Reduction, Meditations, Cleanses, Positive Mental/Social Well-being, Prevention, a Wellness Boot Camp, Enhancing Immunity and more.<br><br>If you have a doctor who is an MLiQ office, your information will be automatically transmitted to your private files so that you and your provider will be able to design personalized health programs, providing you with support and oversight, and giving you 24/7 access to communicating with the office.<br><br>Education is critical in empowering you with the knowledge to make your own health care choices/better health care choices. MLiQ includes information, research and consumer based education to this end.<br><br>Welcome to the ART OF LIVING WELL.","My Lifestyle iQ","https://play.google.com/store/apps/details?id=com.azularc.chyropractic"
"com.evlop.shopify.ikealifestylemyanmar","USD","Philip More","true","https://play-lh.googleusercontent.com/ZUjcuoFsfikzm5XD7U1sJASYWD_-YRLWr_VHhrSGtGUpMvbU6-nHPzWhpzop51d3Y6g","0",,,"lifestyle","Welcome to our Simple Lifestyle store app! Browse through our wide selection of stylish and affordable furniture, all from the convenience of your iPhone or iPad. With our easy-to-use interface and intuitive navigation, finding the perfect piece of furniture for your home has never been easier.<br><br>Our app features a range of furniture styles to suit any taste or budget, from modern and minimalist to classic and traditional. Whether you&#39;re looking for a comfortable sofa, a stylish coffee table, or a luxurious bed frame, we&#39;ve got you covered.<br>And with our secure checkout process and fast shipping, you can have your new furniture delivered straight to your door in no time.","Simple Lifestyle","https://play.google.com/store/apps/details?id=com.evlop.shopify.ikealifestylemyanmar"
"com.espresa.client","USD","Espresa Inc.","true","https://play-lh.googleusercontent.com/lTxWxQsXN7Z9kdZlnFLMViw0kmHHh91vGFRtCRVLlAGZskndO4eQWDA827f4RvrD9nY","0","4.521739","4.5","lifestyle","Espresa puts personalized lifestyle benefits at your fingertips—curated by your HR team to fit your needs.<br><br>From Lifestyle Spending Accounts (LSA) to Wellbeing, Recognition, and Employee Communities, Espresa helps bring your benefits to life.<br><br>Your HR team chooses your adventure—Espresa makes it simple to explore, connect, and engage with programs designed to support your work-life experience.<br><br>Download the app and sign in with your work email to get started.<br><br>When Challenges are enabled by your Company Administrator and you are participating in a challenge with fitness tasks, Espresa will import your fitness activities from the connected app of your choice. You will be first asked for permission to access the Health data and, once the permission is granted, Espresa will keep your Challenges up to date when you open the app. Please keep the permission enabled to participate in Challenges using fitness data!","Espresa: Lifestyle Benefits","https://play.google.com/store/apps/details?id=com.espresa.client"
"com.tagmango.ironmanlifestyle","USD","TagMango, Inc","true","https://play-lh.googleusercontent.com/kBDkC5YCSLoAysQBf2Jeqt1heo6YsaPxSE4sl1mb4pVHU55a2UjtRUJScUY89XVgS8vK","0",,,"lifestyle","Key Features:<br>Dating Mastery: Unlock dating success with expert advice, dating tips, and relationship insights.<br>Personal Development Hub: Transform your life with self-improvement techniques, mindset shifts, and actionable strategies.<br>Events and Workshops: Join exclusive dating events, workshops, and personal development seminars hosted by India&#39;s No. 1 Men&#39;s Dating Coach.<br>Podcasts and Interviews: Gain insights from inspiring podcasts and interviews featuring renowned personalities.<br>Curated Content: Lifetime access to a library of articles, videos, and tools for continuous learning in dating and personal growth.<br>Community : A community for like minded men to share, connect, and learn from one another.<br><br>Who is Iron Man Lifestyle for?<br>Working professionals seeking dating advice and fulfilling relationships.<br>College students looking to build confidence, overcome social anxiety, get more dates, and have an epic social life.<br><br>Empower your dating life with Iron Man Lifestyle for epic self-discovery! Download the FREE app now !!","Iron Man Lifestyle","https://play.google.com/store/apps/details?id=com.tagmango.ironmanlifestyle"
