"appId","currency","developer","free","icon","price","score","scoreText","searchTerm","summary","title","url"
"com.getmimo","USD","Mimo: Learn to Code","true","https://play-lh.googleusercontent.com/qPfmmEDFhGVmIXIKpmfbQeH6vXygXotzj6ied-j2el0YIB36fApN32XoVDrGoMQZ11Q","0","4.718001","4.7","education","Code anytime, anywhere, with an innovative and interactive programming and code learning app in your pocket!  Learn programming in Python, HTML, JavaScript, SQL, CSS, TypeScript, React, Express, and Node.JS on the go with the Mimo coding app, an accessible and beginner-friendly code app. With bite-sized lessons, a flexible learning schedule, and tons of practice, Mimo: Learn Programming guides you step by step, making learning programming and practicing your Python, JavaScript, React, HTML coding skills easy. In just 5 minutes a day, you can learn code of the popular programming languages like Python, HTML, or JavaScript, practice and learn coding, work with the code to build projects, and get certified for your skills in no time. <br><br>Whether you&#39;re a beginner or a seasoned developer looking to expand your skill set in HTML, JavaScript, or Python coding, the Mimo Learn to Code app is one of the best coding apps for beginners and intermediate coders. Its programming curriculum, clear instructions, intuitive user interface, and simple lessons are perfect for anyone who wants to start learning to code. Learn Python, JavaScript, HTML, or other programming languages and start to code from scratch, build projects, boost your programming skills, improve your technical proficiency, and begin to code on your own in no time with Mimo. <br><br>Here&#39;s what you can do with the Mimo: Learn Coding/Programming app: <br>• Python, HTML, JavaScript, SQL, CSS, TypeScript, React, Express, Python AI, and Node.JS code<br>       - Learn Python to automate tasks, analyze data, and explore AI and machine learning. <br>       - Learn how to build websites using JavaScript, HTML, and CSS.<br>• Advance your career with Mimo&#39;s career paths in full-stack, front-end, Python coding, and backend web development.<br>• Run code and build real projects on the go with our intuitive mobile code editor - IDE. <br>• Practice what you learned in optional practice and projects. <br>• Practice past topics, coding playgrounds, and track progress in the Practice tab. <br>• Learn code and build a habit with streaks and daily reminders. <br>• Build a project portfolio to showcase to potential clients or employers.<br>• Get certification in Python, JavaScript, HTML programming, or any programming language or career path, and share your achievements on platforms such as LinkedIn.<br><br>🏆 Google Play&#39;s Editor&#39;s Choice<br>🏅 Best Self-Improvement Apps<br><br>Mimo gives you a structured way to learn programming at your own pace, right from your phone. Master computer science and learn code of the programming languages like Python, HTML, JavaScript, SQL, CSS, TypeScript, React, Express, Node.JS, and JavaScript. Master Python coding to automate tasks, analyze data, and explore AI and machine learning. Build websites from scratch using JavaScript, HTML, and CSS.<br><br>You can learn to code in Python, HTML, JavaScript, TypeScript and master complex programming concepts with ease. Supercharge your programming skills, build awesome projects, or become a frontend, full-stack, or backend web development expert, and kickstart your career in tech. With Mimo Learn to Code, you can enjoy coding and practice what you&#39;ve learned with hands-on challenges. With Mimo&#39;s career paths, you get structured learning of Python, HTML, JavaScript code, and other programming languages for entry-level jobs in tech. Learn coding, apply what you&#39;ve learned, build a portfolio, and get your dream job.. <br><br>Mimo: Learn Programming/Coding app&#39;s testimonials:<br>- &quot;This way, you can work learning to code into your daily routine whenever you have a few minutes.&quot; – TechCrunch.<br>- &quot;The app&#39;s lessons are bite-size to make it easy to squeeze coding into your busy day.&quot; – The New York Times.<br><br>Start your coding journey with the Mimo Learn Programming app and unlock your career in tech. With our courses in Python, HTML or JavaScript, TypeScript, CSS, SQL, React, real projects, and tons of practice, you can learn to code and reach your career aspirations. You can code, too!","Learn Coding/Programming: Mimo","https://play.google.com/store/apps/details?id=com.getmimo"
"com.adaptedmind.mobile","USD","AdaptedMind","true","https://play-lh.googleusercontent.com/nYxQL4y0rlEzH7-iE3oXuhB78nt-NHCOg-QcIC08ojRcUZzisEjVPColaD0fkBxk6CBm","0","4.516667","4.5","education","Embark on an exciting math adventure with AdaptedMind, where learning becomes an immersive journey! Designed for students in grades PreK-8, AdaptedMind transforms math education into a captivating experience filled with interactive games, engaging puzzles, and challenges that adapt to each child&#39;s learning pace. Every problem is a mystery to solve, and every achievement unlocks new levels of excitement, fostering not just math skills but a lifelong love of learning. At AdaptedMind, real learning is delightful.<br><br>WHY CHOOSE ADAPTEDMIND&#39;S MATH PROGRAM?<br><br>Pretest Assessment: Start your child’s learning journey with a pretest that evaluates their math skills, allowing us to create a customized learning plan based on their strengths and areas for improvement.<br><br>Personalized Learning: Our adaptive technology crafts a unique learning path for each child, catering to their needs and pace. Whether they need reinforcement or a challenge, we’ve got them covered.<br><br>Fun &amp; Engaging Content: Explore our extensive library of interactive math lessons, practice exercises, worksheets, and games that bring math concepts to life through enjoyable activities.<br><br>Explanatory Videos: Access instructional videos led by experienced educators, offering visual explanations for every problem and enhancing understanding through our concept explanation videos.<br><br>Progress Tracking: Easily monitor your child’s progress with detailed reports and analytics, keeping you informed about their strengths and areas needing improvement, so you can provide targeted support.<br><br>Proven Results: Join the 95% of our members who experience increased math confidence and ability. With AdaptedMind, your child gains the confidence to excel in math and beyond. Whether they’re starting their math journey or mastering advanced concepts, we’re here to support their mathematical growth.<br><br>SUBSCRIPTION DETAILS<br><br>Enjoy a 30-day free trial upon signup. Payment will be charged to your Apple ID after the trial period ends. The subscription automatically renews unless auto-renewal is turned off at least 24 hours before the end of the current period.<br><br>Terms of Service: https://www.adaptedmind.com/info/legal<br>Privacy Policy: https://www.adaptedmind.com/info/privacy","AdaptedMind Math","https://play.google.com/store/apps/details?id=com.adaptedmind.mobile"
"org.pbskids.gamesapp","USD","PBS KIDS","true","https://play-lh.googleusercontent.com/nYDg7dx-itdjoZ8hj3JcVBvI254VEEKKhv6DUzjqhICJ1lUbBvRbvgJPZD-EkN8-4A","0","4.3643427","4.4","education","The PBS KIDS Games app makes learning fun and safe with educational games for kids featuring favorites like Daniel Tiger, Wild Kratts, Lyla in the Loop, and more! Your child can play and learn with 250+ free educational games designed just for them!<br><br>Play and learn with PBS KIDS in English and Spanish with favorites like Alma, Rosie, and more. Download fun games for kids and play from the safety of your home or anywhere to keep the fun going offline.<br><br>Your child will learn and play in a safe, kid friendly interface, making preschool, kindergarten, and early elementary education fun and easy. Start your child’s learning adventure today!<br><br>SAFE GAMES DESIGNED FOR KIDS<br>* PBS KIDS Games provides a safe, kid friendly playing experience for your child or toddler<br>* Play mini games that boost imagination and allow kids to learn with beloved PBS KIDS characters<br><br>PLAY GAMES OFFLINE<br>* Download fun kids games and play offline!<br>* Kids can easily browse and play at home, on the road, or anywhere<br>* Download games to keep learning on the go<br><br>LEARNING GAMES FOR GRADE SCHOOL EDUCATION<br>* 250+ FREE curriculum-based games for kids ages 2-8<br>* Encourage early learning with educational games for kids with different school subjects<br>* Explore mazes, puzzles, play dress-up, coloring, and more<br>* Preschool and kindergarten games<br>* Math games<br>* Science games<br>* Reading games<br>* Art games<br>* And more!<br><br>NEW GAMES ADDED WEEKLY<br>* Kids will learn and have fun with new games added frequently<br>* Play new games with accessibility features to enhance the fun!<br>* Build STEM skills with science, engineering, and math puzzles<br>* Play games geared to help with social concepts like kindness, mindfulness, and emotions<br>* Games and activities for kids that can foster healthy habits by learning daily routines<br>* Spark creativity and imagination with art games<br><br>PLAY GAMES FROM PBS KIDS SHOWS<br>* Daniel Tiger’s Neighborhood<br>* Wild Kratts<br>* Lyla in the Loop<br>* Work It Out Wombats!<br>* Rosie’s Rules<br>* Alma’s Way<br>* Donkey Hodie<br>* Odd Squad<br>* Pinkalicious &amp; Peterrific<br>* Arthur<br>* Elinor Wonders Why<br>* Let’s go Luna<br>* Xavier Riddle and the Secret Museum<br>* Scribbles and Ink<br>* Clifford<br>* Molly of Denali<br>* Sesame Street<br>* Nature Cat<br><br>PLAY IN ENGLISH OR SPANISH<br>* Bilingual kids will enjoy playing with Alma, Rosie, and more in English and Spanish<br>* Spanish speakers can play 17 educational games<br><br>PARENT RESOURCES<br>* Manage the app’s device storage for offline fun<br>* Download related PBS KIDS apps to expand your child’s learning<br>* Learn more about PBS TV shows, such as intended age and learning goals<br>* Find your local PBS KIDS station schedule<br><br>Play fun educational games and join your kids on a learning adventure alongside their favorite PBS KIDS characters with the PBS KIDS Games app!<br><br>Download PBS KIDS Games and start learning today!<br><br>ABOUT PBS KIDS<br>PBS KIDS, the number one educational media brand for kids, offers all children the opportunity to explore new ideas and new worlds through television, digital platforms, and community-based programs. PBS KIDS Games is a key part of PBS KIDS’ commitment to making a positive impact on the lives of children through curriculum-based media—wherever kids are. More free PBS KIDS games are also available online at pbskids.org/games. You can support PBS KIDS by downloading other PBS KIDS apps in the Google Play Store.<br><br>AWARDS<br>* Kidscreen Awards (2024): Best Game App – Branded, Digital, Preschool<br>* Webby Winner and Webby People’s Voice Winner (2023)<br>* Kidscreen Award Winner (2021 and 2022): Preschool - Best Game App<br>* Parents&#39; Choice Recommended Mobile App (2017)<br><br>PRIVACY<br>Across all media platforms, PBS KIDS is committed to creating a safe and secure environment for children and families and being transparent about what information is collected from users. To learn more about PBS KIDS’ privacy policy, visit pbskids.org/privacy.","PBS KIDS Games App","https://play.google.com/store/apps/details?id=org.pbskids.gamesapp"
"com.duolingo.literacy","USD","Duolingo","true","https://play-lh.googleusercontent.com/gnhFgUBwTzfRhBsNnkEHiY68xmYVlovPF9COih3ASF1Q48qPlWTOkyDyh27u10NXXNg","0","4.1504855","4.2","education","From the creators behind Duolingo, the world’s #1 education app, comes Duolingo ABC! Duolingo ABC is the fun, hands-on way for your child to learn to read and write in English! From preschool to first grade, engage your child with delightful stories for kids and bite-sized lessons teaching the alphabet, phonics, sight words, vocabulary, and more.<br><br>The Duolingo ABC kids reading app offers over 700 hands-on reading lessons designed to help kids learn and love to read. We make learning to read both fun and effective with lessons and educational games for kids that include multi-sensory activities, such as tracing, drag-and-drop prompts and more. Our educational learning app offers personalized lessons so your child can learn at their own pace.<br><br>Develop reading comprehension skills with educational lessons specially designed to support your child’s lifelong love of learning! Whether your child is in pre-K, preschool, kindergarten, or 1st grade, Duolingo ABC has delightful stories for kids filled with engaging pictures meant to inspire and support your child along their educational journey. <br><br>Help your child learn to read new sight words with our toddler books and kids stories that let you highlight each word spoken. This helps build your child’s multi-sensory learning skills and can help them learn to read independently.<br><br>Duolingo ABC makes your child’s education a fun and engaging experience. Our learning app combines educational lessons with fun reading games perfect for kids and toddlers alike! Our rewards work in tandem with bite-sized reading lessons and fun school games for kids, keeping them motivated to learn while building their confidence.<br><br>Discover ad free kids educational games filled with exploration and curiosity on Duolingo ABC. Now your kids can have fun while they sound out words, practice reading and writing in English, and build reading comprehension and literacy skills for a lifetime!<br><br>DUOLINGO ABC FEATURES:<br><br>Kids Learn to Read<br>- Reading games: Our kids reading app provides hands on learning they will love<br>- New lessons are added often, so your child never runs out of educational content<br>- Reading and phonics for kids: Bite-sized lessons help kids learn phonics, sight words &amp; vocabulary<br>- Every reading lesson is built to feel like a game, so kids can learn to read while having fun<br><br>Learning Activities For Kids<br>- Enjoy fun educational games like letter tracing and gamified stories, suitable for even the youngest learners<br>- Toddler, kindergarten or first grade, all kids can enjoy the Duolingo ABC learning app while having fun<br>- From toddler books to 1st grade learning games, Duolingo ABC has lessons for every child<br>- Designed by literacy &amp; early-education experts to develop kids’ skills in phonics, sight words, reading &amp; more<br><br>Kid-Safe &amp; Ad-Free<br>- Our educational learning app prioritizes a kid-friendly experience<br>- Rest easy, parents. There are no ads or in-app purchases to worry about<br>- Content is focused on preschool, kindergarten and first grade level lessons, so you can be safe knowing it is always age-appropriate<br><br>Offline Learning<br>- Your child’s educational journey has no limits with Duolingo ABC’s offline learning capabilities<br>- On a plane? At a restaurant? Duolingo ABC can be used anytime, anywhere<br>- Enjoy playing and learning offline - so kids can learn wherever you go<br><br>Duolingo ABC is an educational learning app that offers immersive lessons to teach preschool to first grade kids to learn and love to read. Download today and spark your child’s love for learning.<br><br>--<br><br>Privacy Policy: https://www.duolingo.com/privacy<br>Terms of Service: https://www.duolingo.com/terms","Learn to Read - Duolingo ABC","https://play.google.com/store/apps/details?id=com.duolingo.literacy"
"com.education.android.h.intelligence","USD","GauthTech Pte. Ltd.","true","https://play-lh.googleusercontent.com/1CnI8ztueH5zyg2PLN1qEcPaL_j56Y48gEr2OKcD31ce799Qw91_U0QneDLmwYlCo3w","0","4.7700887","4.8","education","Gauth is the #1 AI study companion powered by newest AI model! Trusted by millions of users, Gauth offers unlimited answers for all subjects. Try Gauth for all your learning needs!<br><br>Key Features:<br>► ACCURATE ANSWERS, STEP-BY-STEP<br>Compared to other homework helpers, Gauth is faster and more accurate at solving homework problems, especially with the support of Gauth AI Pro. Problems could be solved quickly within a few seconds, and all answers are accompanied by animated instructions and detailed explanations.<br><br>► DEEPTHINKING, INSPIRE YOUR LEARNING<br>Powered by Gauth AI, integrates the advantages of multiple AI models and solves your problems smarter and more deeply. With Gauth AI, we hope you can get inspired and learn efficiently.<br><br>► MASTER ALL SUBJECTS, ALL GRADES<br>Not only Math questions, Gauth could now solve all different levels of problems in Physics, Chemistry, Biology and more. <br><br>► REAL EXPERTS READY TO HELP 24/7<br>As a strong and resourceful homework solver, we have professional experts and dedicated experts ready to help you 24/7 with multiple subjects, including Math, Physics, Chemistry, and Biology. All experts are available to solve your problems anytime and anywhere, offering clear step-by-step explanations. With Gauth, you can easily understand and master different subjects.<br><br>► EASY TO USE, HOMEWORK IS COOL<br>Simply take a photo of your problem, and Gauth will recognize it and crop your question automatically. After uploading, our experts will provide solutions in a few seconds with well-formatted answers and explanations. With Gauth, we hope you can find homework is also fun and easy to understand!<br><br>► SUBJECTS COVERED<br>- Math<br>- Biology<br>- Physics<br>- Chemistry<br>- Others<br><br>► MATH TOPICS COVERED<br>- Math Word problems<br>- Algebra (Real Number; Arithmetic; Set theory; Expression; Logarithm; Complex Number)<br>- Function (Linear; Quadratic; Polynomial; Exponential; Rational; Logarithmic; Inverse Function)<br>- Geometry (Plane &amp; Solid Geometry; Algebra &amp; lines; Lines &amp; Planes in Space; Transformation)<br>- Trigonometry (Trigonometric Ratios; Law of Sines; Law of Cosines; Reciprocal Properties)<br>- Calculus (Derivatives; Integrals; Limits; the Tangent/Area Math problem)<br>- Statistics and Data Analysis (Probability; Data Representation; Poisson/Normal Distribution)<br>- Matrix (Matrix Algebra; System of Linear Equations &amp; Matrices)<br>- Logic (Reasoning &amp; Proof)<br><br>► Want to level up your learning? With Gauth Plus, you will get:<br>- Unlimited answers and explanations<br>- High accuracy in answers<br>- Access to 20M+ tutorial videos<br>- A question bank of 100M+<br>- 24/7 tutor help<br><br>Terms of Service https://h5.gauthmath.com/terms<br>Privacy Policy https://h5.gauthmath.com/policy","Gauth: AI Study Companion","https://play.google.com/store/apps/details?id=com.education.android.h.intelligence"
"com.hellotalk","USD","HelloTalk Learn Languages App","true","https://play-lh.googleusercontent.com/_n5qVwKyfl5QiJjyZiTvTM8z4WN63Da8EAhRUkKtLMjIZ3aHNkAXlvF89V_uzYMQxg","0","3.592938","3.6","education","Practice languages with native speakers on HelloTalk! We recently introduced HelloTalk Live and Voiceroom - interactive language and culture events to help you master languages through the content you love! <br><br>HelloTalk, the original language exchange app, connects you with native speakers to practice languages (English, Japanese, Korean, Spanish, French, Mandarin Chinese, Portuguese, German, Italian, Russian, Arabic, Turkish, Hindi, Indonesian, Thai, Vietnamese and 160+ more) for FREE! <br><br>HelloTalk equips you with learning tools such as translation and instant captions so you can learn by chatting with native speakers. Learn languages from locals around the world through livestreams and Voicerooms. Connect with expert hosts to discuss interesting topics with language partners in the learning community! <br><br>Why HelloTalk? <br><br>► Real language learning atmosphere <br>Whether you&#39;re focused on a widely spoken language or a less common one, HelloTalk caters to your needs. The system smartly matches you based on your native language and proficiency, while allowing you to filter ideal language partners according to various criteria such as age, location, and gender. Plus, with built-in translation and transliteration tools, you can communicate confidently without any language barriers.<br><br>► A powerful tool for sharpening your language skills<br>Acquiring new words through conversations with native speakers is more effective than rigid memorization. Whether you&#39;re a student preparing for exams like the CET, GRE, TOEFL, IELTS, planning to study abroad, or a professional seeking career advancement through language skills, HelloTalk offers native speakers who match your proficiency level for engaging interactions and valuable learning experiences.<br><br>► Immersive multi-person language chat rooms<br>If you choose to learn Spanish, for example, every Voiceroom you enter on HelloTalk gathers Spanish learners and Spanish native speakers from around the world to discuss interesting topics. Here, only your voice needs to be heard, creating a comfortable, introvert-friendly atmosphere. Here, sharing mutual interests allows everyone to freely express themselves and share personal experiences, fostering both language intuition and authentic expression skills. It&#39;s incredibly addictive!<br><br>► Diverse global Livestreams<br>HelloTalk features handpicked foreign language hosts who offer online video lessons, share language insights, and provide glimpses into their lives abroad. You can even join them on stage for one-on-one video conversations with fellow language learners. Whether you&#39;re grappling with pronunciation, speaking speed, or shyness, these hosts will assist you in refining your language skills and guiding the conversation. For rapid improvement in spoken language, there&#39;s no substitute for direct communication with native speakers!<br><br>► International Moments<br>HelloTalk&#39;s Moments offers real-time posts covering learning, lifestyle, and cultural insights from around the world. It&#39;s your ticket to discovering fresh perspectives and gaining deeper insights into diverse cultural customs, all from the comfort of your home. Don&#39;t forget to engage with posts that catch your interest!<br><br><b>What the world is saying about HelloTalk</b> <br><br>❤️ ❤️ ❤️🌟🌟🌟 <br>Editor&#39;s Choice - Google Play<br>“One of the best apps to help you learn a new language.” - 9to5Mac <br>&quot;When you&#39;re ready to experiment with a foreign language, HelloTalk provides an excellent opportunity for interaction with other speakers.&quot; –PCMag <br>&quot;HelloTalk, which connects native speakers with an apprentice, also offers language exchanges to its 20 million users in more than 150 languages.&quot; -Forbes <br><br>START PRACTICING LANGUAGES RIGHT AWAY!!!<br><br>Learn more about the HelloTalk app: <br>- Facebook: https://www.facebook.com/Hellotalk/ <br>- Twitter: https://twitter.com/hellotalkapp <br>Send any feedback to support@hellotalk.com <br>- Privacy Policy: https://www.hellotalk.com/privacy-policy <br>- Terms of Use: https://www.hellotalk.com/terms-of-service","HelloTalk - Learn Languages","https://play.google.com/store/apps/details?id=com.hellotalk"
