"appId","currency","developer","free","icon","price","score","scoreText","searchTerm","summary","title","url"
"com.sillens.shapeupclub","USD","Lifesum","true","https://play-lh.googleusercontent.com/7fNrWWPMQZgIs_sVv5Bb3jME5KbEqguW8n4PDo4FsZzvI-xGE2jiJQ2ah8xdkvyTNQ","0","4.3577824","4.4","lifestyle","<b>A revolutionary way to track your meals, enhanced by AI.</b> <br>Welcome to a new era of nutrition tracking, tailored to your style. With the new Lifesum experience, you can choose to log your meals by snapping a photo, using your voice, typing a text, or scanning a barcode. <br>We made food tracking easy so you can make more healthy choices for your body and mind.<br><br><b>JOIN 65 MILLION USERS ON THE PATH TO BETTER HEALTH.<b><br>Health isn’t about perfection—it’s about progress. Lifesum encourages small, manageable changes that add up to lasting results. <br>Whether it’s drinking more water, adding more fruits and veggies to your plate, or choosing healthier snacks, Lifesum celebrates every win, no matter how small.<br><br><b>SMARTER, SIMPLER MEAL TRACKING<b><br>📸 Snap a photo to get instant nutrition details.<br>🎙 Speak for easy, hands-free logging.<br>⌨   Type for more detailed tracking.<br>✅ Scan barcodes for fast info.<br>⚡ Use quick tracking for simple entries.<br><br><b>TOP LIFESUM FEATURES<b><br>🔢  Calorie counter<br>📊  Macro tracker and food rating<br>🥗  Diet plans for weight management and body composition<br>⏳  Intermittent fasting plans<br>💧  Water tracker<br>🍏  Fruit, vegetable, and fish tracker<br>📋  Meal plans with grocery lists included<br>🏃  Integration with Google Health for in-depth health monitoring<br>⚡ Life Score test for personalized nutrition recommendations<br><br><b>WEIGHT MANAGEMENT AND HEALTHY EATING<b><br>Whether you&#39;re looking to manage your weight, eat healthier, or simply feel better in your everyday life, Lifesum provides the tools and support to make your goals achievable, sustainable, and enjoyable.<br>From balanced meal plans to specialized lifestyles like keto, paleo, or high protein, Lifesum adapts to your preferences and needs. <br>Simply share your goals, preferences, restrictions, and activity levels, and Lifesum creates nutrition plans just for you.<br>Lifesum also offers a massive library of delicious recipes, all crafted to help you eat smarter without compromising on flavor.<br><br><b>BEYOND CALORIES: A COMPLETE WELNESS SOLUTION<b><br>Lifesum goes beyond simple calorie counting. With its unique Life Score feature, the app evaluates your overall health based on your eating habits, hydration, and activity levels. <br>This helps you focus on long-term well-being instead of short-term fixes. <br><br><b>ALL YOU NEED FOR A CUSTOMIZED EXPERIENCE<b><br>✔Calorie counter, with the option to adjust your daily calorie goal and add/exclude calories burned through exercise.<br>✔Macro tracking and adjustable goals for carbs, protein, and fat intake. <br>✔Create and save your favorite foods, recipes, meals, and exercises.<br>✔Body measurement tracking (weight, waist, body fat, chest, arm, BMI).<br>✔A library of thousands of recipes with smart filters for quick results.<br>✔A weekly Life Score based on nutrition and exercise measurements.<br>✔Track and integrate with Wear OS - A calorie tracker, water tracker, or view your exercise on your watch face. The Wear OS app works independently, so it doesn&#39;t require the Lifesum app to be downloaded. The Lifesum app integrates with Google Health allowing users to export nutrition and activity data from Lifesum to Google Health, and import fitness data, weight and body measurements to Lifesum. <br><br>Lifesum is free to download and use with limited features. For the full Lifesum experience, we offer 1-month, 3-month, and annual Premium auto-renewing subscriptions.<br><br>Payment is charged to your credit card through your Google Play account at confirmation of purchase. Subscription renews automatically unless you turn off auto-renewal in Google Play account settings or cancel your subscription at least 24 hours prior to the end of the subscription period.<br><br>View our Terms &amp; Conditions and Privacy Policy: https://lifesum.com/privacy-policy.html</b></b></b></b></b></b></b></b></b></b></b></b>","Lifesum: AI Calorie Tracker","https://play.google.com/store/apps/details?id=com.sillens.shapeupclub"
"com.netpulse.mobile.lifestylefitnessapp","USD","EGYM","true","https://play-lh.googleusercontent.com/scFHs6sdZxou9rjkQYK9GCWqIsGlgPCZuYNcEo1VBRSbfOzf_ZnG_5M7kNUybDHdeys","0",,,"lifestyle","Elevate your fitness routine with the app! It&#39;s your all-in-one solution to easily monitor your workouts, track progress, and achieve your fitness goals with engaging insights and motivation.<br><br>The app offers an array of features, including:<br><br>Workout Tracking<br>Seamlessly capture all your workout data from gym equipment or manually enter it for a complete record.<br><br>Training Plans<br>Optimize your workouts with personalized plans provided by your fitness facility or trainer.<br><br>Activity Levels<br>Stay motivated with encouraging milestones as you progress to higher levels.<br><br>Fun Challenges<br>Challenge yourself with time-based activities that reward you with kudos, activity points, and prizes.<br><br>Schedules<br>Manage and book classes with ease to keep yourself on track.<br><br>And much more!<br><br>Have a comment or question about the app? Email our team directly at digitalsupport@egym.com.","LIFESTYLE Fitness App","https://play.google.com/store/apps/details?id=com.netpulse.mobile.lifestylefitnessapp"
"com.remente.app","USD","Remente","true","https://play-lh.googleusercontent.com/8OinW-77LBJIvELycMeGVU7Bp2gcKWjNNAlJ6weqNTe7tMvJc4hg5MPrUBrKnDFLZEoC","0","4.258197","4.3","lifestyle","Small actions everyday <b>create life changing behaviors</b>. Our <b>mental health tracker and self care journal</b> helps you with goal setting and <b>achieving personal growth!</b> Remente acts as your life coach and provides a bunch of self help tools to feel better and glow up and achieve <b>self improvement, healthy habits and well being</b>.<br><br><b>Start now with developing healthy habits to improve your self control and live a healthy lifestyle with greater self love, more self help and less stress, anxiety and depression!</b><br><br><b>Daily Remente</b><br>A daily video session with a life coach explaining different concepts of daily self care and interactive guides for users to learn about and practice mental health and well being.<br><br><b>Goal Setting Guide</b><br>Create good life goals to achieve personal growth and development. Remente acts as your life coach and offers guides and tips for goal setting to form a sustainable lifestyle which results in self love and healthy habits. <br><br><b>Day Planner</b><br>To learn self help and reach goals you need to plan. The day planner contains a smart and dynamic to do list which plans your day based on your life goals as well as long term goal actions and tasks for self improvement.<br><br><b>Mental Health Tracker</b><br>Tracking your life balance is important for your well being and self love and reducing stress and depression. The life assessment tool helps you determine where you should focus your personal development efforts to feel better and glow up and achieve self control, mindfulness and health.<br><br><b>Self Care Journal</b><br>Learn what makes you feel good with the Remente mood journal. By tracking your mood you will understand what consequences your habits have on your mental health. What habits increase your daily self care? Use the mood journal to find out! <br><br><b>Expert Goal Plans</b><br>Remente has a library full of expertly crafted goal plans to coach your self improvement. They contain detailed plans, tips and information for how to succeed with common well being goals to achieve personal growth and a better lifestyle.<br><br><b>Courses &amp; Articles</b><br>A curated collection of articles and exercises written by psychologists, business managers, life coaches and world champions in several fields. We cover a wide range of topics, e.g. sleep optimization, stress management, healthy habits, mindfulness and anxiety relief, self love or tips for better friendships, relationships, dating &amp; sex.<br><br>We offer a premium subscription which contains extra features and content that will support your self improvement and personal growth even more. The purchase is handled by your Google account. The subscription can always be cancelled or changed by going to the Google Play settings and will be renewed 24 hours before it expires, identical to the one you last purchased. It is not possible to cancel an already purchased subscription.<br><br>Behind Remente are <b>experts in the fields of psychology, coaching and mental training</b>. With our mental health tracker and self care journal we&#39;ve helped around 2.000.000 people so far with their goal setting and achieving anxiety relief, self control and well being. Allow us to improve your self help and personal growth for a better lifestyle and to feel better and glow up. Become a member of the Remente family now!","Remente: Self Care, Wellbeing","https://play.google.com/store/apps/details?id=com.remente.app"
"com.masterweb.lifestyle","USD","Lifestyle LLC","true","https://play-lh.googleusercontent.com/2Au5hihZlUoA8YIZof6GNmyoc3PX_BPPn4GslRmZZ8gN9a4OPCTz5hKyr-hIdUwxT3o","0",,,"lifestyle","Мы работаем на армянском рынке более 6 лет. За этот промежуток времени у нас появилось  много постоянных клиентов, которыми мы очень дорожим, и делаем все возможное, чтобы они вновь и вновь обращались к нам. <br><br>В Lifestyle Perfume Вы найдете большое количество ароматов от самых известных торговых марок мира по самым удобным ценам.<br><br>Постоянные акции на нашем сайте сделают Ваши покупки еще более выгодными!","Lifestyle Perfume","https://play.google.com/store/apps/details?id=com.masterweb.lifestyle"
"com.boxtribe.lifestyle","USD","The Lifestyle Way","true","https://play-lh.googleusercontent.com/MnSc_r4UGyLdr87joZv5Jh0YQrQa4dmhDG4ammEtJD0Ljm1cNaFHs0oC1uuEFKAmETwB","0",,,"lifestyle","The Lifestyle Way is a step by step program teaching you how to change your mindset so you can feel more confident.  We have different options for you to choose from an 8 week course, one on one nutrition coaching, or a monthly subscription which gives you workouts, nutrition calculations, and monthly nutrition check ins.<br>Let me teach you to have a better relationship with food and make this program actually stick with you for the rest of your life!","The Lifestyle Way","https://play.google.com/store/apps/details?id=com.boxtribe.lifestyle"
"com.limatech.dayschallenge.dayschallenge","USD","Kati & Lima","true","https://play-lh.googleusercontent.com/oeO0RvaL7YONsssV_yv4IfzVZYaeyyhZHLbM9XYD-EwQWlo0HHzHNOl_NKdRBgI1rfzA","0","4.71671","4.7","lifestyle","Create your ideal life with life-changing habits.<br>It is estimated that it takes people 21 days to form a new habit. So it’s a perfect amount of time to change or introduce something new in your life. Choose the best challenge for you (or create your own) and do it for 21 days and you’re going to see how the habit becomes part of your lifestyle day by day.<br><br>Starting a healthy lifestyle, taking a break away from the internet, practicing gratitude, learning a new language, trying to be more productive, finding happiness, self-help, how to study effectively, ways to spread kindness and positivity, tips for fixing your sleeping schedule, self-care practices, decluttering, being more confident, writing journal prompts and daily positive affirmations are some of the challenges that you can find in the app.<br>Basically, you can use this app as a habit tracker.<br><br>Once you complete your daily task, you can mark it as completed and collect the points (to customize your avatar, to unlock motivational reminders and free wallpapers).<br><br>In the gratitude challenge, you can write your thoughts and share them in the feed (it can be anonymous too). Here you&#39;re going to see all the community answers and you can also give it a like, comment, or send gifts to your favorite ones.<br><br>Create a healthier and happier mind with journaling. With this app, you can write a daily journal and choose your daily mood. Then you can track your mood in the calendar and see all your previous records.<br><br>There’s a selection of positive wallpapers for your phone and motivational reminders to share with your friends. Also, some relaxing music. <br><br>Enable notifications and choose the time to be notified to remind you to do the challenge every day.<br><br>You have all of this in one app for free!<br><br>Don’t forget to take care of your body and mind. It&#39;s the only place you have to live. <br><br>Your journey to self-improvement and better mental health starts today!","21 Days Challenge","https://play.google.com/store/apps/details?id=com.limatech.dayschallenge.dayschallenge"
"com.tunjunganplaza.mobile","USD","Pakuwon Jati","true","https://play-lh.googleusercontent.com/F-Pfg3fyafFpeHl2kElxXT3OrI30sTFsuXHPJmy78DnEKdPoeS59wpY6UG5eMvF-Cg","0",,,"lifestyle","Tunjungan Plaza adalah pusat perbelanjaan di Indonesia yang sudah berdiri lebih dari 30 tahun. Seiring dengan perubahan jaman, Tunjungan Plaza terus berbenah untuk memberikan yang terbaik bagi pelanggan setianya. Bertujuan memudahkan aktifitas berbelanja di era digital, Tunjungan Plaza meluncurkan program personal shopper “Tasya” sejak bulan Juli 2020. Tasya memberi kemudahan untuk berbelanja di semua store yang terdapat di Tunjungan Plaza hanya melalui aplikasi WhatsApp dari gadget. Tasya juga melayani pengiriman ke seluruh Indonesia, sehingga pelanggan di daerah lain dapat berbelanja di Tunjungan Plaza.<br><br>Tahun 2021, Tasya meningkatkan inovasinya dengan meluncurkan situs katalog elektronik pada bulan Februari. Ratusan brand di Tunjungan Plaza kini dapat diakses melalui situs tersebut lengkap dengan foto dan harga produk sehingga memudahkan pelanggan memilih sesuai keinginan. Selain itu, Tasya juga memberikan promo menarik setiap bulan seperti cashback, ongkos kirim gratis, dan lain-lain. Dengan Tasya, kemudahan, kenyamanan, dan keamanan berbelanja ada dalam genggaman dari seluruh wilayah di Indonesia.","Pakuwon Lifestyle","https://play.google.com/store/apps/details?id=com.tunjunganplaza.mobile"
"com.bankly.bloomm","USD","Powered By Bankly MFB","true","https://play-lh.googleusercontent.com/6fe0EqKc0w15thGczAKf4-LCPakg0DLHr8huUJ4M742ls816BtUMFXZpELFTTxDdlWw","0","4.0263157","4.0","lifestyle","<b>Bankly is a lifestyle bank that moves you forward.</b> <br><br>Unlike other bank apps, the Bankly app has unique features that enable our customers to earn as they spend. Pay all kinds of bills and earn commissions. Contribute for projects and special events while earning up to a whopping 15% interest per annum and also earn up to 12% per interest when you save with Bankly. That’s not all. The Bankly app offers much more!<br><br><b>Bankly App Features</b><br><br><b>NUBAN Bank Account:</b> <br>👉 Open a NUBAN account after signing up.<br>👉 This account is used to receive money and is powered by Bankly MFB.<br><br><b>Funds Transfer:</b> <br>👉 Customers can send money to any bank account in Nigeria with their account seamlessly, and funds sent are received by recipients in less than 30secs. Our transfers don&#39;t fail.<br><br><b>Referral Bonus:</b> <br>👉 When you refer a friend, you both get a N500 bonus each, when the person registers on the Bankly App and funds their account with at least N500.<br>👉 By sharing a unique link, a Bankly customer can cash out N5,000 for every 10 successful referrals. <br><br><b>Group Contributions:</b><br>👉 Start a contributions plan with family and friends to achieve a common goal<br>👉 Contributors can leave the plan willingly<br>👉 To ensure transparency, all members can monitor the progress of their contributions, and each member receives notification for every deposit and withdrawal done in the group contribution plan.<br>👉 Earn up to 15% interest yield per annum on the group contribution plan.<br><br><b>Individual Savings:</b><br>👉 With the savings feature, Bankly customers earn as much as 12% per annum.<br>👉 Bankly customers can set targets, and create daily, weekly, and monthly saving plans that accrue daily interest over time. <br><br><b>Discount on Bills Payments:</b><br>👉 With this feature, Bankly users can pay bills and earn simultaneously.<br>👉 For every bill payment made on the Bankly app - electricity, airtime, or data – you earn up to 2% of the value, which is paid as a commission into your account. <br>👉 Electricity Billers: Ikeja Electric, Eko Electric, Ibadan Electric, Abuja Electric, Jos Electric, Kano Electric, Kaduna Electric, Enugu Electric, Port Harcourt Electric, Benin Electric<br>👉 Airtime and data Billers: MTN, 9Mobile, Airtel, Glo<br>👉 Cable TV: DSTV, StarTimes, GOtv<br><br><b>Save2Win Jackpot Game:</b><br>👉 The Save2Win jackpot game encourages savings by giving users a chance to win as much as N10,000 cash prize daily. <br>👉 If a user saves a minimum of N200, they will get a ticket to play in the jackpot game and compete for the daily cash prize.<br>👉 In addition, savings are intact even if they don’t win the daily prize, and they still get a 12% interest per annum on savings. <br><br><b>Account Statement:</b><br>👉 On the first day of every month, users are sent bank statements that can be used to track their financial habits.<br>👉 They are also able to request an account statement for specific periods, which can be sent to embassies for immigration purposes, potential employers, or any other purpose unique to the user. <br><br><b>Why choose the Bankly app?</b> <br>👉 Bankly makes your overall banking experience simpler and more affordable. Rather than get charged for keeping money with brick-and-mortar banks, here, you earn interest on your savings. <br>👉 You also earn commissions on bill payments rather than pay 100 Naira for every bill you pay with other banks. <br><br><b>Contact us</b><br>Bankly is a registered trademark of 5554 Technologies Limited Ltd with RC 1509344 as a duly registered legal entity in Nigeria, with the Nigerian Corporate Affairs Commission. Bankly is licensed and regulated by the Central Bank of Nigeria<br><br>Address: 11b Oko Awo Street Victoria Island, Lagos<br>Website: www.bankly.ng<br>Email: hello@bankly.ng  <br>Whatsapp: 09131038000 <br>Phone number: 07000225522 OR 08039900060 <br>Twitter: @banklyng<br>Instagram: @banklyng<br>Facebook: https://www.facebook.com/Banklytech<br><br>Bankly is not associated with other digital banks like Kuda, Palm pay, Carbon, MoniePoint, Opay, and ALAT by Wema.","Bankly - Lifestyle Bank","https://play.google.com/store/apps/details?id=com.bankly.bloomm"
"com.tagmango.internetlifestylehub","USD","TagMango, Inc","true","https://play-lh.googleusercontent.com/bd1WZvtv8FqIACDKli8VsInIoa1wv7BBoeUdCN6xs1SeM_FSFp3oXyvCaeg65ZD_zw","0","0","0.0","lifestyle","Get access to all premium content in Internet Lifestyle Hub. Access pre-recorded courses, enrol for live workshops, get certified and a lot more! Be a part of the awesome community that you always wanted to be in!","Internet Lifestyle Hub","https://play.google.com/store/apps/details?id=com.tagmango.internetlifestylehub"
"com.zurich.livewell","USD","LiveWell by Zurich","true","https://play-lh.googleusercontent.com/8HA96Sx6bpLPCQ1Po6LO9AxmnidMgaqSb5aTZ5CD_wfo8PxI8ObYcb50ze7NgvPeKrHs","0","3.2","3.2","lifestyle","Achieve a Balanced, Healthier Life with LiveWell – Your Toolkit for Complete Health<br><br>Embark on an inspiring journey towards optimal health and wellness with LiveWell, a cutting-edge app designed to help you visualize and realize your healthiest self. Whether it’s building healthy habits, managing stress, or enhancing your exercise and diet habits, LiveWell is your guide to a fulfilling wellness journey.<br><br>Dynamic Features:<br><br>    1 Goal Setting for Success: Establish and track your health and wellness objectives. LiveWell is not just a health tracker; it’s your guide to achieving your goals, be it in fitness, nutrition, sleep, or stress management.<br>   2 Holistic Wellness Tracker: Seamlessly integrate with top fitness apps, including Google Fit. Our tracker dives deep into your sleeping habits, workout routines, and overall life balance, offering insights to fine-tune your daily regimen.<br>   3 Expert Wellbeing Guidance: Access tailored advice on meditation, stress relief, and maintaining healthy routines. Navigate your path to a healthy life with our evidence-based guidance.<br>   4 Sleep Cycle Insights: Keep track of your sleep data and get insights and advice on how to improve your sleep. Wake up refreshed and ready to tackle your goals.<br>   5 Nutrition and Exercise Plans: Embrace diet plans and exercise routines that adapt to your evolving fitness journey. Stay on track with your diet and workout goals for a healthier, more vibrant you.<br>   6 Master Stress Management: Discover effective stress relief techniques and guided meditation practices. Manage stress and cultivate mental peace as part of your everyday routine.<br>  7  Motivating Rewards and Challenges: Earn points by engaging in wellness activities. Participate in challenges that foster positive habits and enjoy rewards that fuel your journey.<br>  8  Connect with a Community: Join a community that shares your wellness aspirations. Build relationships and engage in social activities that boost your social health.<br><br>LiveWell’s Commitment to 360 Health Plan:<br>Inspired by the WHO’s insights into lifestyle-related health issues, LiveWell is committed to empowering you with tools and solutions for lasting health and wellbeing. We focus on four essential pillars - physical, mental, social, and financial health - to guide you towards a balanced life.<br><br>By integrating practical health checks and telemedicine services, LiveWell supports your proactive approach to wellness. Our platform is a treasure trove of health and wellbeing content, putting you in control of your health journey.<br><br>Your Health, Your Journey:<br>With LiveWell, you’re not just keeping an eye on your health; you’re actively shaping it. Embrace a lifestyle of prevention and positive change. Let LiveWell be your ally in achieving your health and fitness goals, maintaining healthy routines, and creating a life of balance and wellness.<br><br>LiveWell is the perfect app for those looking for an ADHD medication tracker, ADHD mood tracker, and ADHD planner. It’s a balance health app that promotes better health and better sleep. With LiveWell, you can achieve betterhealth and enhance your body fitness with a comprehensive care routine. Our fitness tracker and habit tracker features help you stay on top of your health goals. Live well with LiveWell, the ultimate me daily routine planner and mood tracker. Improve your morning routine and monitor your sleep cycle with ease. Stay hydrated with our water tracker and improve your overall wellbeing with the best wellbeing app. LiveWell offers the ultimate wellness living experience, no matter where you are, even in Zurich.<br><br>Disclaimer: LiveWell is a companion in your health journey, providing insights and guidance. It is not a substitute for professional medical advice or treatment.<br><br><br>(1) https://www.who.int/news/item/09-12-2020-who-reveals-leading-causes-of-death-and-disability-worldwide-2000-2019","LiveWell - Make Health a Habit","https://play.google.com/store/apps/details?id=com.zurich.livewell"
