"appId","currency","developer","free","icon","price","score","scoreText","searchTerm","summary","title","url"
"com.unitedassociates.apps.ella","USD","United Associates Inc.","true","https://play-lh.googleusercontent.com/KIMilGqSSgylK4t42B_KC7bFyxIuFJuxFCy_qEB_e1heWRJiu1J9weSetxwlo3-56qyr","0",,,"education","Ella School: AI English Learning Companion<br><br>&quot;Boost your English fluency with Ella School: Speak More, Learn Faster!&quot;<br><br>Boost your child&#39;s English speaking confidence with Ella, the AI-powered learning platform designed for young learners. Ella creates a safe, supportive environment where children can practice speaking English, learn from mistakes, and grow their language skills.<br><br>Our platform features:<br><br>- A comprehensive speaking curriculum aligned with American public education standards<br>- Over 540 age-appropriate topics and 4,860 subtopics (as of April 2024)<br>- Adaptive speech levels tailored to each learner&#39;s abilities<br>- Content filtering to ensure a child-friendly experience<br><br>Key Features:<br><br>1. Engaging AI conversation partners: Ella and her friends make English practice fun and comfortable<br>2. Natural language focus: Learn authentic English used by native speakers<br>3. Personalized feedback: Receive AI-powered suggestions and grammar corrections<br>4. Interactive learning: AI-generated talking diary after each session<br>5. Safe learning environment: Strong privacy protection and responsible content policies<br>6. Educational purpose: All AI-generated content is for learning use only<br><br>Note: While Ella School is a fantastic learning tool, she may not always provide accurate information on subjects outside of English language learning. We encourage responsible app usage and parental guidance.<br><br>Download Ella today and watch your child&#39;s English skills soar!<br><br>* Ella Terms of Use<br>https://ella.school/teens/terms_of_use.html<br><br>* Ella Privacy Policy<br>https://ella.school/teens/privacy_policy.html<br><br>* Ella 101 Safety Guideline<br>https://ella.school/teens/Ella_101_Safety_Guideline.html<br><br>* Developer Contact: support@ella.school","Ella School - English Learning","https://play.google.com/store/apps/details?id=com.unitedassociates.apps.ella"
"com.expo.trainify.production.android","USD","Nuumi","true","https://play-lh.googleusercontent.com/6GDOa_F5I5etuDrYYHq62y2HIdTSy-NE5QMu_hnYDbkA9hbstEn6HekUtfzlk7kPRw","0",,,"education","Trainify prepares you to excel in workplace certification tests. Test your knowledge with a comprehensive question bank in a game-like learning environment!<br><br>HYGIENE PASSPORT<br>Learn the fundamentals of food hygiene with a course plan designed by industry professionals. The courses are structured into engaging, easy-to-follow lessons that you can complete at your own pace. The hygiene passport study plan includes: 8 courses, 20 lessons and 700+ practice questions. The materials are available in Finnish, English and Russian.<br><br>ALCOHOL PASSPORT<br>Learn Finnish alcohol law in an interactive way with 3 courses, 20 lessons and 600+ practice statements.<br><br>OCCUPATIONAL SAFETY CARD<br>The first app for official occupational safety training in Finland, designed by experts and approved by the Occupational Safety Center.<br><br>ALL COURSES IN ONE PACKAGE<br>With a single payment, get instant access to all learning materials, including food hygiene, alcohol serving, and work safety card courses.<br>WHY CHOOSE TRAINIFY?<br>Get unlimited access to all 120+ lessons and 1,000+ practice questions. Study anytime, anywhere!<br>Trainify, founded in 2024, is a fast-growing Finnish company with over 10,000 users.<br><br>Learn more: www.trainify.com","Trainify","https://play.google.com/store/apps/details?id=com.expo.trainify.production.android"
"com.classdojo.android","USD","ClassDojo","true","https://play-lh.googleusercontent.com/gKVjyfeXOCb1JBdDuQvhudzGG2tWmTS27A6DSn66GPU3HyVnAsm_u8M8-yrcfCBbgwQ","0","4.8013906","4.8","education","Ready to build an amazing classroom community?<br><br>ClassDojo is a beautiful, safe, and simple communication app for teachers, parents, and students. <br><br>* Teachers can encourage students for any skill, like “Working hard” and “Teamwork”<br>* Teachers can bring parents into the classroom experience by sharing photos, videos, and announcements<br>* Students can add their classwork easily to their own digital portfolios for their parents to see<br>* Teachers can also safely and instantly message with any parent<br>* Parents see their child’s updates at home, as well as a stream of photos and videos from school<br>* All your favorite teacher tools, like Group Maker and Noise Meter, are now in one place!<br><br>ClassDojo helps teachers build a positive classroom culture by encouraging students and communicating with parents.<br><br>ClassDojo is free for everyone, and K-12 teachers, parents, students, and school leaders in over 180 countries have joined. It works on all devices, like tablets, phones, computers, and smartboards.<br><br>See how much people love ClassDojo at: www.classdojo.com/wall-of-love/<br><br>Join the ClassDojo community today!","ClassDojo","https://play.google.com/store/apps/details?id=com.classdojo.android"
"com.ixl.ixlmath","USD","IXL Learning","true","https://play-lh.googleusercontent.com/KXdJB5aXz-u9QcPLnXrqSj-uxE15o3Hokft77hU5fiDFUbwucHbqrYGGPtkah90hxw","0","4.1889353","4.2","education","IXL is personalized learning! Trusted by over 1 million educators and parents, IXL is proven to accelerate student achievement. And with the award-winning IXL app, students can master skills anytime, anywhere!<br><br>See how IXL meets the unique needs of over 16 million learners (and counting!):<br><br>SUPERIOR SKILL-BUILDING<br>With IXL’s full curriculum of over 10,000 skills, students of all levels can learn the exact topics they need, whether they’re reviewing past concepts or exploring new territory. Immediate feedback and step-by-step answer explanations help students work through their mistakes and make lasting progress. Plus, question difficulty adapts to challenge students at just the right level and help them grow.<br><br>MATH MASTERY<br>With IXL’s preK-12 curriculum, every learner can excel in math! From skip-counting with pictures to graphing quadratic functions, students interact with dynamic problem types that bring each concept to life. And with unlimited questions to explore, students can practice as much as they need to master each skill, and never see the same problem twice.<br><br>LANGUAGE ARTS LEARNING<br>IXL’s preK-12 curriculum helps build strong readers and writers! From comprehension to composition, IXL breaks down each concept into highly targeted skills that help students grow from where they are. Fun and relevant questions engage students as they learn new vocabulary, correct grammar mistakes, analyze text, strengthen writing skills, and more. <br><br>SCIENCE, SOCIAL STUDIES, AND SPANISH<br>Build knowledge across all core subjects! With comprehensive curriculum in 2nd through 8th grade science and social studies, students can learn exciting and relevant concepts about the world around them. And with foundational Spanish, students can get started on the path toward Spanish fluency!<br><br>REAL-TIME DIAGNOSTIC <br>IXL’s Real-Time Diagnostic pinpoints each student’s current knowledge level in math and English language arts. As students answer questions, they’ll discover more about themselves, and reveal personalized recommendations on the best skills to learn next! <br><br>IMMERSIVE EXPERIENCE<br>Interactive features, from drag-and-drop questions to graphing tools, allow students to engage with the material in new ways. With handwriting recognition, students can easily write in math answers with their fingertips. On tablets, students can work through each problem by writing on their screen—no scrap paper needed! Plus, colorful awards highlight students’ accomplishments and make learning fun!<br><br>PROVEN RESULTS<br>Research has shown that IXL improves student outcomes more than any other product or method. IXL is trusted by over 1,000,000 teachers worldwide!<br><br>ACTIONABLE ANALYTICS<br>View reports on all progress at IXL.com! Tackle any trouble spots with specific insights and clear next steps. And celebrate reaching each new milestone with an official certificate!<br><br>Practice 10 questions each day for free. To accelerate growth, become an IXL member! For $19.95 per month, you’ll get access to a fully personalized learning experience with comprehensive curriculum, meaningful guidance, progress tracking, fun awards, and more!<br><br>IXL is kidSAFE certified and COPPA-compliant. For more information, please visit:<br>Membership details: https://www.ixl.com/membership<br>Privacy Policy: https://www.ixl.com/privacypolicy","IXL","https://play.google.com/store/apps/details?id=com.ixl.ixlmath"
"mobi.abcmouse.academy_goo","USD","Age of Learning, Inc.","true","https://play-lh.googleusercontent.com/691m_3IWwkiVObqha9aZoDXB1oDiVHxpa-FRxKra-6yM9UVugdHUvHhYh2YxucUuNrc","0","3.7397296","3.7","education","Math and Reading for Kids 2–8<br><br>ABCmouse is the award-winning learning program that covers reading, math, art, music, and more for kids ages 2 to 8. Created by teachers and education experts, it has 10,000+ exciting Learning Activities for children at all academic levels.<br><br>Key Features<br><br>The ABCmouse Early Learning Academy is the research-validated program that kids 2–8 love to play with as they learn:<br><br>• Full standards-based curriculum for learning on mobile devices<br>• Trusted by teachers and designed by early learning education experts<br>• Used in more than 70,000 classrooms and in nearly half of all U.S. public libraries<br>• 10 levels, over 850 lessons, and 10,000+ individual Learning Activities<br>• All academic subjects for toddlers, preschool, kindergarten, 1st grade, and 2nd grade<br>• Accelerates children’s development of early literacy and math skills<br>• Helps ensure kindergarten readiness and 3rd grade readiness<br>• Covers math, reading, science, social studies, art, and music across all levels<br>• Thousands of books, videos, puzzles, printable activities, songs, games, and animations<br>• 900+ books and activities in Spanish <br>• Customizable Avatar, My Room, My Hamster, and Pet Park features<br>• Step-by-Step Learning Path and independent learning<br>• Great for homeschoolers and learning on the go<br>• Easy to track and monitor progress <br>• Winner of prestigious Mom’s Choice GOLD, Teachers’ Choice, and Parents’ Choice GOLD Awards<br>• 100% safe and kid-friendly environment!<br><br>Subscription Options<br><br>• Subscription automatically renews unless auto-renew is turned off at least 24-hours before the end of the current period<br>• Account will be charged for renewal within 24-hours prior to the end of the current period, and identify the cost of the renewal<br>• Subscriptions may be managed by the user and auto-renewal may be turned off by going to the user&#39;s Account Settings after purchase<br><br>See our full Terms and Conditions at:<br>http://www.abcmouse.com/tandc<br><br>View our Privacy Policy at:<br>http://www.abcmouse.com/privacy<br><br>Min Specs for Android Tablet/Phone:<br>Android Version: 9.0<br>Memory (RAM): More than 4GB RAM<br>Storage: 16 GB","ABCmouse – Kids Learning Games","https://play.google.com/store/apps/details?id=mobi.abcmouse.academy_goo"
"com.quizlet.quizletandroid","USD","Quizlet Inc.","true","https://play-lh.googleusercontent.com/hiQHKRhpuGu4pWAFhpto9H7qWKSdX-BjKbDAtZYgm_jfoD0cN7MCllGOn6L3XWo-6Q","0","4.701151","4.7","education","Choose from millions of pre-made decks or create your own set of flashcards to commit the material to memory! Whether you’re prepping for an exam, tackling a homework assignment, or earning a new certificate to advance your career, Quizlet helps you learn anything with engaging study activities.<br><br>Memorize the material with flashcards<br>* Create flashcards from scratch, or let AI generate a deck for you by uploading your study materials<br>* Sort cards into “know” and &quot;still learning&quot; to track your progress<br>* Save your decks for offline access and study anywhere.<br>* Discover flashcard sets created by millions of students and teachers, saving you time and effort<br><br>Challenge yourself with practice questions<br>* Turn any flashcard set into practice questions to reinforce your knowledge.<br>* Quizlet adapts questions based on what you know and what needs more work, helping the material stick.<br>* Mix it up with different question types, from multiple-choice to written responses, to deepen your understanding.<br>* Seamlessly pick up where you left off across all your devices.<br><br>Test your knowledge with exam-ready tests<br>* Simulate test day with a personalized practice test generated from any flashcard set.<br>* Customize the number of questions and formats to challenge yourself in different ways.<br>* Get instant scoring feedback to identify areas to improve and build your confidence.<br><br>Finish your homework faster<br>* Get expert-authored, step-by-step solutions to tough homework problems.<br>* Check your work in challenging subjects like Calculus, Chemistry, and Electrical Engineering.<br>* Need more help? Use AI-powered support to explore each step of the solution or generate alternative approaches.<br> <br>Quizlet Plus subscriptions will be charged to your iTunes account. Your monthly or annual subscription automatically renews unless canceled at least 24 hours before the end of the current period. Manage your subscriptions in your Account Settings after purchase. Some features may not be available in your country or region.<br><br>Terms of Service: https://quizlet.com/tos<br>Privacy Policy: https://quizlet.com/privacy","Quizlet: Study with Flashcards","https://play.google.com/store/apps/details?id=com.quizlet.quizletandroid"
"com.alison.mobile.flutter","USD","Alison eLearning","true","https://play-lh.googleusercontent.com/rTCPek-E3RAEmq6r0oQxw8i3lfH9fkHuItkRmDrHRanR1HCGUuNmg_zmm1YfPgWANH8","0","4.730245","4.7","education","Learn Anything, Anywhere, Anytime For Free.<br><br>Earn globally recognised, CPD-accredited diplomas and certificates from over 5,500 courses. Join Alison’s community of 45 million+ learners from over 195 countries on the world’s largest free online learning and empowerment platform.<br><br>Are you looking to upskill? <br><br>Or looking for a career change?<br><br>Perhaps, you want to launch a side hustle?<br><br>Whether you’re a student, a recent graduate, an employee, an entrepreneur, or simply a lifelong learner – Alison gives you access to the tools you need to empower yourself and get closer to your dream future.<br><br>Learn across 9 categories: IT, Health, Language, Business, Management, Personal Development, Sales &amp; Marketing, Engineering &amp; Construction, and Teaching &amp; Academics<br><br>WITH ALISON, YOU CAN<br>Tailor your learning based on your needs and interests<br>Build job-ready skills for in-demand roles<br>Grow industry-relevant knowledge and upskill<br>Showcase accredited Certificates and Diplomas on your resumé <br><br>WITH THE ALISON APP, YOU GET<br>Free access to 5,500+ mobile-friendly CPD-accredited courses<br>Course content suitable for use in areas with low internet connectivity<br>Personalized course recommendations <br>Flexible self-paced learning at your own convenience<br>To schedule study reminders and track your progress<br>Synced coursework progress across all your devices<br><br><br>POPULAR CERTIFICATE COURSES<br>Media Studies - Gaming, the Internet and Social Media<br>Teaching English as a Foreign Language (TEFL)<br>Fundamentals of Health and Social Care<br>JavaScript Application Programming<br>Learning Lean Six Sigma: White Belt<br>Basics of Motivational Interviewing<br>Anger Management and Conflict Resolution<br><br>POPULAR DIPLOMA COURSES<br>Diploma in Caregiving<br>Diploma in Business Administration<br>Diploma in Customer Service<br>Diploma in Mental Health<br>Diploma in Environmental Management<br>Diploma in Workplace Safety &amp; Health<br>Diploma in Food Safety<br><br>Learn with expert-curated study material: Increase your knowledge by getting access to over 5,000 free courses with certificates created by subject matter experts. Who knows, you might just end up being more skilled than your boss (if you aren&#39;t already).<br><br>Pick up right where you left off: Whether you’re at the beach, in the mountains, or lazing in bed under a blanket, your learning never has to stop. Unless of course, you want to stop.<br><br>Explore our extensive directory of industry-relevant courses: Is there a new skill out there? We&#39;ve got a course for it. With our ever-evolving course library, learn data science, animation, marketing, cybersecurity, real estate, interior design, creative writing, and much more. When there is solid proof of alien life on Earth, we&#39;ll have a course on how to talk to them too.<br><br>Share your achievements: Get your certificates and diplomas posted right to your doorstep. Hang it on your wall or just hang out with it, we won’t judge.<br><br>Take your career forward with Alison in just a few clicks - empower yourself today!<br><br>Alison is a for-profit social enterprise, dedicated to ensuring anyone can study anything, anywhere, at any time, for free online.","Alison: Online Education App","https://play.google.com/store/apps/details?id=com.alison.mobile.flutter"
"com.microblink.photomath","USD","Google LLC","true","https://play-lh.googleusercontent.com/Ma_HEbK1LzEoayR0tE0ZXqLopug69-dPspfCV36zzHOSuC0_i6mu5ulKz1eY7en-UM4","0","4.356157","4.4","education","Photomath is known worldwide for helping millions of learners to learn, practice, and understand math – one step at a time. <br><br>Scan any math problem with the Photomath app to get step-by-step explanations with accurate solutions and a variety of teacher-approved methods. Math is about the process, so Photomath breaks your problem into bite-sized steps to help you understand the “what” and “why” along with the “how.” Whether you’re learning basic arithmetic or advanced geometry, we’ll tackle it together, step by step. <br><br>Why Photomath? <br><br>Billions of math problems: From elementary arithmetic to advanced calculus and everything in between, Photomath can solve billions of math problems—including word problems! Whether handwritten, in a textbook, or on a screen, Photomath is here to help you untangle your trickiest problem.<br><br>Step-by-step explanations: Math isn’t just about an answer. It’s about every step along the way. That’s why Photomath breaks down each step, so you can *really* learn. Less guesswork = less stress, especially with our new Animated Steps, which show you the exact progression of a particular step. Get basic step-by-step explanations at no charge when you download Photomath.<br><br>Expert-developed methods: Photomath’s educational content is centered around the learner’s experience, driven by the expertise of our own team of mathematicians and former math teachers. <br><br>Self-paced learning: Photomath’s instant support is like having a 24/7 virtual tutor. Checking your homework before dinner? Stuck on a problem at 2am? We can help. Follow our detailed steps, taking whatever time you need to review definitions, rationale, and more – all within the explanation.<br><br>Want to dive deeper and explore more ways to learn? Photomath Plus can get you there with custom Animated Tutorials, detailed Textbook Solutions, and more! <br><br>KEY FEATURES<br>• Step-by-step explanations included in our basic version (free of charge)<br>• Word problem instructions<br>• Interactive graphs<br>• Video learning<br>• Multiple solution methods<br>• Advanced scientific calculator<br><br>Photomath is for learners of all levels, including those studying:<br>Numbers &amp; Quantity<br>Algebra<br>Functions<br>Trigonometry &amp; Angles<br>Sequences<br>Geometry<br>Calculus<br><br>“The step-by-step guide is beneficial to students that do not have access to a tutor and struggle with solving math problems.” — Forbes<br><br>“A viral video about a new app looks like a dream come true for anyone who struggles with math.” — Time<br>___________________________________________<br><br>• Payment will be charged to your Google account at the confirmation of purchase. <br>• A subscription automatically renews unless it’s canceled at least 24 hours before the end of the current billing period. <br>• Your account will be charged for renewal within 24 hours prior to the end of the current period. <br>• Manage or cancel your subscription in your account settings on the Google Play after purchase. <br>• Offers and pricing are subject to change without notice. <br><br>Suggestions or questions? Email us at support@photomath.com <br><br>Website: www.photomath.com<br>TikTok: @photomath<br>Instagram: @photomath <br>Facebook: @Photomathapp <br>Twitter: @Photomath <br><br>Terms of Use: https://photomath.app/en/termsofuse <br>Privacy Policy: https://photomath.app/en/privacypolicy","Photomath","https://play.google.com/store/apps/details?id=com.microblink.photomath"
"com.udemy.android","USD","Udemy","true","https://play-lh.googleusercontent.com/dsCkmJE2Fa8IjyXERAcwc5YeQ8_NvbZ4_OI8LgqyjILpXUfS5YhEcnAMajKPrZI-og","0","4.470956","4.5","education","Skill up to success. Udemy is a leading destination for online courses that empowers you to grow professionally and personally. Get the app to explore our expansive library of thousands of topics with cutting-edge online video courses in Coding, Development, Python, Java, Business, Marketing, SEO, SEM, Drawing, Photography, and much more.<br><br>Tap into knowledge from around the world by learning from real-world experts. With courses in over 65 languages, you’ll probably find the right course for your goals.<br><br>Here’s what makes learning with the Udemy app so valuable:<br><br>LEARN OFFLINE: Download courses and learn even when your internet connection is unreliable<br><br>LEARN ON THE BIG SCREEN: Watch courses with Chromecast<br><br>DARK MODE: Stay focused in any lighting condition<br><br>LEARNING REMINDERS: Build your learning routine with customised push notifications that fit your schedule<br><br>NOTES: Maximise your learning by taking notes and adding bookmarks to remember more of what you learned<br><br>QUIZZES: Take in-course quizzes to reinforce your learning<br><br>Q&amp;A: Ask instructors your burning questions to increase your knowledge or get a little extra help<br><br>LIFETIME ACCESS: Take courses on your schedule. Revisit them as needed.<br><br>Many instructors update courses (at no extra cost) to bring you the latest knowledge as it becomes available. Making learning with us is a short- and long-term investment in your success.<br><br>Other popular topics people are learning to achieve their goals:<br>App Development: Android, iOS, Swift<br>Data Science: R, Machine Learning, Artificial Intelligence<br>Marketing: Mobile, Social Media, SEM, SEO<br>Art, Music, Drawing, Photography, Health &amp; Fitness<br><br>Learners around the world trust Udemy to launch new careers, advance in their current field, and reap the benefits of lifelong learning.<br><br>Take control of your future with online courses that deliver practical, professional skills. Prepare for certification exams in IT, Project Management, and more. Earn certificates of completion for paid courses to showcase on your CV or impress in your next interview.<br><br>Join millions of learners around the globe and improve your life through learning!","Udemy - Online Courses","https://play.google.com/store/apps/details?id=com.udemy.android"
"com.moodle.moodlemobile","USD","Moodle Pty Ltd.","true","https://play-lh.googleusercontent.com/WETi4kiHx6KfyGBDsZ1-jgPdAATt8n6Fq4tK05TOBe_z6NxsoWjrGkDyy8PIW29pvJw","0","4.527578","4.5","education","This official app will ONLY work with Moodle sites that have been set up to allow it.  Please talk to your site administrator if you have any problems connecting.<br><br>If your site has been configured correctly, you can use this app to:<br><br>- Browse the content of your courses, even when offline<br>- Receive instant notifications of messages and other events<br>- Quickly find and contact other people in your courses<br>- Upload images, audio, videos and other files from your mobile device<br>- View your course grades<br>- and more!<br><br>Please see http://docs.moodle.org/en/Mobile_app for all the latest information.<br><br>We’d really appreciate your feedback on what else you want this app to do!<br><br>The app requires the following permissions:<br><br>- Record audio: For recording audio to upload to your site as part of a submission<br>- Read and modify the contents of your SD card: Contents are downloaded to the SD Card so you can see them offline<br>- Network access: To be able to connect with your site and check if you are connected or not to switch to offline mode<br>- Run at startup: So you receive local notifications even when the app is running in the background<br>- Prevent phone from sleeping: So you can receive push notifications anytime","Moodle","https://play.google.com/store/apps/details?id=com.moodle.moodlemobile"
