"appId","currency","developer","free","icon","price","score","scoreText","searchTerm","summary","title","url"
"com.growthday","USD","GrowthDay","true","https://play-lh.googleusercontent.com/0g8cNntbtHtbscYcSYpbLsOAZEU2H1EFq-KZsvuJQXGpgClrMKJ4xfQjW9Wwi_TwPw","0","4.834862","4.8","lifestyle","<b>GrowthDay – The Mindset App for Daily Motivation, Personal Development &amp; Habit Tracking</b><br><br>Want to improve your mindset, feel more motivated, and achieve your greatest potential?<br><b>GrowthDay is the world’s leading personal development app</b> built for people who want to improve consistently, live with intention, and feel unstoppable.<br>This is your all-in-one platform for developing a strong mindset, building better habits, and staying motivated and consistent with your personal growth goals—every single day.<br><br><b>Why GrowthDay is the Leading App to Improve Your Mindset</b><br><br><b>Daily Motivation</b>: Start each morning with Daily Fire, an exclusive daily audio from Brendon Burchard to boost your motivation and energy.<br><br><b>Science-Backed Tools</b>: Use daily, weekly, and monthly assessments to support your personal development and improve your clarity, confidence, and emotional strength.<br><br><b>Guided Journaling</b>: Clear your mind, process emotions, and set powerful intentions with prompts designed for mindset improvement and motivation.<br><br><b>World-Class Coaching</b>: Access expert personal development mentors like Brendon Burchard, Mel Robbins, David Bach, and Jamie Kern Lima.<br><br><b>Track Habits That Build Your Full Potential</b>: Set goals, track your streaks, and stay accountable with the habit tracker built for mental growth and self-improvement.<br><br><b>Join a Growth-Minded Community</b>: Surround yourself with positive, like-minded achievers who are committed to motivation and personal development.<br><br><b>Improve Your Mindset. Change Your Life.</b><br><br>GrowthDay helps you become more—more focused, more confident, more motivated, more productive, more fulfilled. Whether you’re a high achiever or just starting your personal development journey, this app supports continuous mindset improvement and personal growth.<br><br><b>What You Can Do with GrowthDay</b><br><br>- Activate daily motivation and momentum<br><br>- Get expert life coaching from the world’s leading mindset and personal development mentors<br><br>- Track your improvement with science-based assessments<br><br>- Journal with purpose and intention<br><br>- Improve your habits, health, happiness, and motivation<br><br>- Connect with a global personal development community<br><br>- Earn rewards for completing growth tasks and courses<br><br><b>Your Mindset Shapes Your Future. Build It Daily with GrowthDay.</b><br><br>Thousands of people use GrowthDay to stay motivated, improve their mindset, and become more present, powerful, and productive. It’s more than an app—it’s your personal development system for lasting motivation, improvement, and transformation.<br>Download <b>GrowthDay</b>, the leading app for mindset, motivation, and personal growth.<br><b>Ready to feel unstoppable? Start your improvement journey today.</b>","GrowthDay: Motivation Mindset","https://play.google.com/store/apps/details?id=com.growthday"
"app.pineapplelifestyle","USD","thepineappleapp","true","https://play-lh.googleusercontent.com/wTo5Uf3sUjR832nrauZEnrlSeq0jYtkkFJuvXLK3Jl3k6bc-iyqhdMN9bGgBlUIp2mQ","0","2.5833333","2.6","lifestyle","We know that when it comes to exploring your deepest desires, safety is of the utmost importance. <br><br>That&#39;s why we built this app with the protection of our community as our number one priority.<br><br>We believe that this is a space for real, human users, and we take every precaution to ensure that our community is as safe and secure as it is sexy. <br><br>So you can let your guard down and indulge in everything that makes you feel alive.<br><br>- Pineapple is the first app of its kind to verify every single user manually to protect our community.<br>- All accounts are verified by humans to minimise any unwanted attention<br>- Build your profile so you find exactly what you’re looking for<br>- Finally say goodbye to those fake profiles, creeps, and unwanted online attention.<br><br>We put safety first.","Pineapple Lifestyle","https://play.google.com/store/apps/details?id=app.pineapplelifestyle"
"com.crowdstar.covetHome","USD","Crowdstar Inc","true","https://play-lh.googleusercontent.com/bgLDbrd8N6-TdrDiAmeAHURhbNuFu4_kRK-jFpLOzCgg94bgTVMT2_X_TSlYqg-MLQ","0","4.3488193","4.3","lifestyle","Live your interior designer dreams with the world’s top brands and designers on Design Home. Build, renovate, and decorate your dream home when you download today!<br><br>Show off your home planner skills when you download Design Home. Decorate your house with a complete interior and exterior house design experience. Make Design Home your virtual room planner or garden design escape – with chic home decor brands and a true-to-life experience. Design Home is the hit lifestyle game where your dream house comes to life with endless home makeover options. Build, style, and design home interiors you’ve always wanted with Design Home. It’s not just a game – it’s a lifestyle.<br><br>Global house design is at your fingertips with challenges that will test your interior designer skills in a variety of styles. Luxurious kitchen design in Paris, or luxe bedroom decor in Vegas, start decorating everywhere! You can even test your garden design know-how in EXTERIOR DESIGN CHALLENGES for a complete home design experience!<br><br>Explore hundreds of house design options with countless furniture and home decor brands to choose from, and even more added daily. Express yourself as a true interior designer with trends and top brands like Jonathan Adler and West Elm. Design Home makes any dream home possible.<br><br>DESIGN HOME FEATURES<br><br>BECOME THE ULTIMATE INTERIOR DESIGNER<br>- Kitchen design, bedroom design, bathroom design – you name it. Take charge of your next house renovation<br>- House decorating games take new meaning with our immersive 3D builder<br>- Discover a home decor game that lets you control every detail on Design Home<br><br>3D GAMES MEET REAL-LIFE<br>- Design your dream house with over 60 top brands and designers<br>- Discover top trends and professional interior designer options with monthly trend spotlights<br>- Interior Designer Voices - Dive into exclusive challenges with well known designers<br>- Decorate with this month’s latest room design and exterior home design trend<br><br>DREAM HOUSE DESIGN &amp; EPIC REWARDS<br>- Dinnerware, flatware, centerpieces, and MORE! Test your home design skills with tablescaping challenges every Tuesday<br>- Play with Design Pass to earn diamonds, cash, and more<br>- Explore weekly Exterior Design challenges with unique garden design decorations and rewards<br>- Build your dream house with pets! Add cats, dogs, fish, birds, and MORE<br><br>Join a community of over 1 million players daily and vote on designs, get inspired, borrow pieces, and make the boldest statement that is uniquely yours. Live out your interior design fantasies with Design Home and download today.<br><br>Find us!<br>Friend Us on Facebook: https://www.facebook.com/gaming/DesignHomeGame<br>Double Tap us on Instagram: @designhome<br>Watch Us on TikTok: @designhome<br><br>This app: Requires acceptance of EA’s Privacy &amp; Cookie Policy and User Agreement. Requires an Internet connection (network fees may apply). Includes in-game advertising. Collects data through third-party ad-serving and analytics technology (See Privacy &amp; Cookie Policy for details). Allows players to communicate. Contains direct links to the Internet and social networking sites intended for an audience over 13. Includes optional in-game purchases of virtual currency that can be used to acquire virtual in-game items, including a random selection of virtual in-game items.<br><br>User Agreement: terms.ea.com<br>Privacy and Cookie Policy: privacy.ea.com<br>Visit help.ea.com for assistance or inquiries.<br><br>Do Not Sell My Personal Information: https://tos.ea.com/legalapp/WEBPRIVACYCA/US/en/PC/<br><br>EA may retire online features after 30 days’ notice posted on ea.com/service-updates.","Design Home™: House Makeover","https://play.google.com/store/apps/details?id=com.crowdstar.covetHome"
"dk.bodysds.app","USD","Body SDS","true","https://play-lh.googleusercontent.com/W_-JX2Q-bogatI9JJMGjrF_n0lbGrcaz_kynmOAU99nxBHCgLcGaPikIaprPdHNIjC4","0",,,"lifestyle","Hold formen, afspænd kroppen og stress af uanset hvor du er, med videoøvelser, guides, challenges og inspiration.<br><br>Udforsk kategorier som: <br>● Afspænding &amp; Udstræk<br>● Opvarmning &amp; Træning<br>● Yoga &amp; Mindfulness <br>● Graviditet &amp; Baby<br><br>For at få fuld adgang til alt materiale, kræver det et abonnement. Du kan dog altid bruge vores udstræk- og rulleøvelser helt gratis. <br><br>Vigtigt: Alle øvelser og programmer er skabt som inspiration. Døjer du med svære skavanker eller lignende, så anbefaler vi at du først kontakter en professionel før du begynder på øvelserne.","Body SDS Lifestyle","https://play.google.com/store/apps/details?id=dk.bodysds.app"
"com.shredlifestyle.app","USD","Shred Lifestyle","true","https://play-lh.googleusercontent.com/yObdphqYTa0muoQd3GdlHNABYdtyNKytLMa315-GKR8-H1pKY88pMLNKP-fSvkV1tWk","0",,,"lifestyle","Kickstart your fitness journey with Shred Lifestyle, the ultimate app that seamlessly blends nutrition and exercise into a singular, user-friendly experience.<br><br>Shred Lifestyle simplifies the beginning of your fitness journey. Get a personalised workout and meal plan crafted specifically for your fitness goals. Tracking your progress is effortless – log your daily workouts, record meals, and connect your fitness band and health kit for real-time updates through advanced analytics. Everything you need for your fitness goals intelligently organised in one place. Questions on the go? Utilise the in-app 1-1 chat feature for instant support.<br><br>You deserve the best, and Shred Lifestyle delivers. Packed with features, this app is your comprehensive toolkit to conquer your fitness ambitions.<br><br>Start your fitness journey today!<br><br>Key Features:<br><br>Personalised Workout Plan: Tailored fitness plans designed for your specific goals, whether it&#39;s weight gain, weight loss, muscle building, or overall fitness enhancement.<br><br>Nutrition, Hydration &amp; Habits: Access coach-assigned meal plans, log your food intake for precise calorie and macro tracking. Monitor hydration, steps, and calorie burn effortlessly.<br><br>Check-ins: Gain comprehensive insights into your performance with easy check-ins and real-time updates.<br><br>Progress: Stay informed about your journey with powerful analytics.<br><br>Wearable Integration: Connect your fitness band and health kit for a broader perspective on your progress, enabling real-time updates.<br><br>DISCLAIMER:<br><br>Users should seek a doctor’s advice before using this app and making any medical decisions.","Shred Lifestyle","https://play.google.com/store/apps/details?id=com.shredlifestyle.app"
"com.tagmango.tmactorslifestylehub","USD","TagMango, Inc","true","https://play-lh.googleusercontent.com/t9z1fhCpOq5oDtNVLapIFheDlwy6n6hbWJIHgeJzYAlTrUmqRPlxBdVyD8xRAfoeAg","0",,,"lifestyle","Actor&#39;s Lifestyle Hub is your one-stop platform for everything you need to become a successful actor. From exclusive online auditions, industry insights, and expert coaching to mastering on-camera skills, script memorization, and branding strategies, this app guides you through every step of your acting journey. Whether you&#39;re an aspiring actor or a professional, you’ll find tailored resources, live masterclasses, and a supportive community to enhance your skills and confidence. Get access to personalized guidance, learn from industry experts, and unlock opportunities in TV, film, web series, and more. Join Actor&#39;s Lifestyle Hub and turn your dreams into reality!","Actors Lifestyle Hub","https://play.google.com/store/apps/details?id=com.tagmango.tmactorslifestylehub"
"co.tapcart.app.id_B2W0cpnXQl","USD","Baseball Lifestyle 101","true","https://play-lh.googleusercontent.com/hg5m-N1ir0w-OrjV1IKZGH0ILeIqQ0GmLbUkLAGw7D8gcILWJtPBuxQdlmDWKdc1kig","0","4.93","4.9","lifestyle","Baseball Lifestyle 101 is the premiere clothing brand for Baseball fans. Our app offers exclusive discounts and content for our very best customers and fans, giving us a way to grow the game of baseball and give the best experience to every person trying to live a baseball lifestyle. If you&#39;re interested in high-quality clothes, content, and baseball, you&#39;ve found the right place.","Baseball Lifestyle 101","https://play.google.com/store/apps/details?id=co.tapcart.app.id_B2W0cpnXQl"
