"appId","currency","developer","free","icon","price","score","scoreText","searchTerm","summary","title","url"
"com.wonder","USD","Elevate  Labs","true","https://play-lh.googleusercontent.com/uMZu0lwKn6elezZmZHQaav41ScrtJVGCoevdmjT0fMqRR2ydP_2FxWflo_ysYHKG3EoB","0","4.6225233","4.6","education","Elevate is an award-winning brain trainer that uses fun games and brain teasers to improve vocabulary, speaking abilities, processing speed, memory skills, mental math, and more for adults and students. Each person gets a personalized learning program that adjusts over time to maximize results.<br><br>The more you play Elevate, the more you&#39;ll improve practical cognitive skills with engaging brain teasers that boost productivity, earning power, and self-confidence. Over 90% of users notice improvements in vocabulary, memory, math skills, and overall mental sharpness by regularly engaging with our games and exercises. Elevate is designed to test and enhance cognitive abilities, making it a great educational tool. No matter your age, background, or profession, you can benefit from our app through daily practice.<br><br>Elevate offers a 7-day free trial and a free version. Sign up, then tap the X in the top left corner to use the free version.<br><br><b>IN THE NEWS</b><br>“Elevate comes out ahead” in the battle of the brain training apps. - CNET<br>Elevate is a “cognitive pick-me-up” with games that are “good for mental breaks throughout the workday.” - Washington Post<br><br><b>FEATURES</b><br><br><b>40+ Brain Training Games:</b> Improve cognitive skills like vocabulary, focus, memory, processing, math, grammar, precision, and comprehension with 40+ brain training games and puzzles for adults and students.<br><b>Performance Tracking:</b> Measure your performance in language and problem-solving against yourself and others. Weekly reports highlight your key accomplishments and learning opportunities.<br><b>Personalized Workouts:</b> Customize the focus of your daily workouts to train and practice the mind skills you need most. Select from diverse tests, games, and puzzles to stay sharp, increase focus, and build cognitive skills.<br><b>Adaptive Progression:</b> Engage in math and word games that evolve in difficulty as you progress, ensuring a fun and challenging experience that tests and hones your concentration, language, and logical problem-solving abilities.<br><b>Workout Achievements:</b> Start a workout streak with our brain trainer app and stay motivated with 150+ achievements to win while you train your mind.<br><br><b>WHY ELEVATE</b><br><br>Expand your vocabulary with brain teasers. Learn how to use thousands of new words through fun games and puzzles for adults and students.<br>Express yourself more effectively by honing your grammar skills and learning to write with clarity and persuasiveness.<br>Improve your spelling, punctuation, and grammar. Avoid common writing pitfalls with regular practice.<br>Become a better reader and learner. Easily understand language, improve concentration, and logically flow through everyday materials faster.<br>Solve everyday math problems quickly and easily. Improve your problem-solving abilities for comparing prices, splitting bills, and calculating discounts.<br>Boost your focus and memory skills. Get shopping lists out of your pocket and into your mind. Never forget to buy the milk you need or the chocolate you&#39;ve been craving.<br>Speak confidently with strong grammar. Advance your speech with new vocabulary words. Become more articulate and develop clear expression and tone.<br>Feel mentally sharper as an adult. Continue to learn with Elevate&#39;s proven language and logical problem-solving training program.<br><br>Elevate&#39;s brain games, puzzles, and teasers are created with educational experts based on proven educational learning techniques. Our brain trainer’s mental workout algorithms draw from cognitive research in attention, memory studies, and logical reasoning, providing exercises that test and enhance focus and memory skills through deliberate practice. 93% of people who use Elevate frequently feel mentally sharper and more confident in key skills, proving the educational value of our program.<br><br>For more details, see our Terms of Service (https://www.elevateapp.com/terms) and Privacy Policy (https://www.elevateapp.com/privacy).","Elevate - Brain Training Games","https://play.google.com/store/apps/details?id=com.wonder"
"org.khanacademy.android","USD","Khan Academy","true","https://play-lh.googleusercontent.com/TpK0AcjPn5-XDKgSZ5jAob1H7MsQuJILOMR4M4QYkTt5CBPgTJVr7mysrKM6Ia8SrX8","0","4.2284346","4.2","education","You can learn anything. For free.<br><br>Spend an afternoon brushing up on statistics. Discover how the Krebs cycle works. Get a head start on next semester&#39;s geometry. Prepare for upcoming exams. Or, if you&#39;re feeling particularly adventurous, learn how fire-stick farming changes the landscape of Australia.<br><br>Whether you&#39;re a student, teacher, homeschooler, principal, adult returning to the classroom after 20 years, or a friendly alien trying to get a leg up in earthly biology — Khan Academy&#39;s personalized learning library is available to you, for free.<br><br>- Learn anything, for free: Thousands of interactive exercises, videos, and articles at your fingertips. Study math, science, economics, finance, grammar, history, government, politics, and much, much more.<br><br>- Sharpen your skills: Practice exercises, quizzes, and tests with instant feedback and step-by-step hints. Follow along with what you&#39;re learning in school, or practice at your own pace.<br><br>- Keep learning when you&#39;re offline: Bookmark and download your favorite content to watch videos without an internet connection.<br><br>- Pick up where you left off: Tailored to your current learning level, our mastery system gives instant feedback and recommendations on exactly which skills and videos to try next. And, if you choose to create a free account, your learning syncs with http://khanacademy.org, so your progress is always up-to-date across all your devices. <br><br>Learn using expert-created videos, interactive exercises, and in-depth articles in math (arithmetic, pre-algebra, algebra, geometry, trigonometry, statistics, calculus, differential equations, linear algebra), science (biology, chemistry, physics), economics (microeconomics, macroeconomics, finance and capital markets), humanities (art history, civics, finance, US history, US government and politics, world history), and more (including computer science principles)!<br><br>Already familiar with the Khan Academy website? Not all functionality is available in this app. Community discussions, computer programming content, test prep, parent tools, teacher tools, and district tools should all be accessed directly at http://khanacademy.org.<br><br>Khan Academy is a 501(c)(3) nonprofit organization, with the mission of providing a free, world-class education for anyone, anywhere.","Khan Academy","https://play.google.com/store/apps/details?id=org.khanacademy.android"
"com.duolingo","USD","Duolingo","true","https://play-lh.googleusercontent.com/Rz4JVKiQM7ZnLYTEzwzpvWROphw5Wo6kh3vnx8HhgHTaOzsknlTLmXUsknurSqTqUj0","0","4.4694815","4.5","education","Learn a new language with the world’s most-downloaded education app! Duolingo is the fun, free app for learning 40+ languages through quick, bite-sized lessons. Practice speaking, reading, listening, and writing to build your vocabulary and grammar skills.<br><br>Designed by learning experts and loved by hundreds of millions of learners worldwide, Duolingo helps you prepare for real conversations in Spanish, French, Chinese, Italian, German, English, and more.<br><br>And now, you can learn Math and Music the Duolingo way!<br><br>• Build real-world math skills – from calculating tips to identifying patterns – and sharpen your mental math in our Math course. Learn foundational topics like multiplication, fractions, geometry and more, and keep your brain sharp with more challenging exercises, games, and word problems.<br><br>• Learn how to read music and play popular songs on your device in our Music course – no piano or instrument required! Using an on-screen keyboard, you’ll learn bit-by-bit, from finding notes on the keyboard to playing your first song.<br><br>Whether you’re learning for travel, school, career, family and friends, or your brain health, you’ll love learning with Duolingo.<br><br>Why Duolingo?<br><br>• Duolingo is fun and effective. Game-like lessons and fun characters help you build solid speaking, reading, listening, and writing skills.<br><br>• Duolingo works. Designed by learning experts, Duolingo has a science-based teaching methodology proven to foster long-term knowledge retention.<br><br>• Track your progress. Work toward your learning goals with playful rewards and achievements when you make practicing a daily habit!<br><br>• Join millions of learners. Stay motivated with competitive Leaderboards as you learn alongside our global community.<br><br>• Every language course is free. Learn Spanish, French, German, Italian, Russian, Portuguese, Turkish, Dutch, Irish, Danish, Swedish, Ukrainian, Esperanto, Polish, Greek, Hungarian, Norwegian, Hebrew, Welsh, Arabic, Latin, Hawaiian, Scottish Gaelic, Vietnamese, Korean, Japanese, English, and even High Valyrian! And now, learn Math and Music with our newest courses!<br><br>What the world is saying about Duolingo⭐️⭐️⭐️⭐️⭐️:<br><br>Editor&#39;s Choice and &quot;Best of the Best” — Google Play<br><br>“Far and away the best language-learning app.” — The Wall Street Journal<br><br>“This free app and website is among the most effective language-learning methods I’ve tried… lessons come in the form of brief challenges — speaking, translating, answering multiple-choice questions — that keep me coming back for more.” — The New York Times<br><br>“Duolingo may hold the secret to the future of education.” — TIME Magazine<br><br>“...Duolingo is cheerful, lighthearted and fun…” — Forbes<br><br>If you like Duolingo, try Super Duolingo for 14 days free! Learn a language fast with no ads, and get fun perks like Unlimited Hearts and Monthly Streak Repair.<br><br>Send any feedback to android@duolingo.com<br><br>Use Duolingo on the Web at https://www.duolingo.com<br><br>Privacy Policy: https://www.duolingo.com/privacy","Duolingo: Language Lessons","https://play.google.com/store/apps/details?id=com.duolingo"
"com.google.android.apps.classroom","USD","Google LLC","true","https://play-lh.googleusercontent.com/w0s3au7cWptVf648ChCUP7sW6uzdwGFTSTenE178Tz87K_w1P1sFwI6h1CLZUlC2Ug","0","2.6091902","2.6","education","Classroom makes it easy for learners and instructors to connect—inside and outside of schools. Classroom saves time and paper, and makes it easy to create classes, distribute assignments, communicate, and stay organized.<br><br>There are many benefits to using Classroom:<br>• Easy to set up – Teachers can add students directly or share a code with their class to join. It takes just minutes to set up.<br>• Saves time – The simple, paperless assignment workflow allows teachers to create, review and mark assignments quickly, all in one place.<br>• Improves organization – Students can see all of their assignments on an assignments page, and all class materials (e.g., documents, photos, and videos) are automatically filed into folders in Google Drive.<br>• Enhances communication – Classroom allows teachers to send announcements and start class discussions instantly. Students can share resources with each other or provide answers to questions on the stream.<br>• Secure – Like the rest of Google Workspace for Education services, Classroom contains no ads, never uses your content or student data for advertising purposes.<br><br><br>Permissions Notice:<br>Camera: Needed to allow the user to take photos or videos and post them to Classroom.<br>Storage: Needed to allow the user to attach photos, videos, and local files to Classroom. It&#39;s also needed to enable offline support.<br>Accounts: Needed to allow the user to choose which account to use in Classroom.","Google Classroom","https://play.google.com/store/apps/details?id=com.google.android.apps.classroom"
"air.com.starfall.more","USD","Starfall Education Foundation","true","https://play-lh.googleusercontent.com/QRrnPBiqQWpy-WkUiYF4czeIh7A1nRwF3QySBON6gBC_qEjEqTjQIGIU__5d4PpwYZk","0","4.030789","4.0","education","Starfall® fun activities, games, and songs includes reading, math, music, and more – read, learn, and play preschool to fifth grade. Includes free and subscriber content.<br><br>Starfall provides an Enhanced Accessible Index for children with visual, hearing, or mobility impairments. For more information, please contact Customer Service at (+1) 303-417-6414.<br><br>Join Zac the Rat® and his friends on an exciting learning journey, starting with the ABCs and 123s and advancing up to grade 5 grammar and mathematics. Starfall&#39;s playful open format intuitively guides children through sequential learning objectives for reading, math, art, music, and social subjects like kindness and caring.<br><br>*Highlights*<br><br>*Reading (phonics, fluency, grammar) -- ABCs, Learn to Read, I’m Reading, Talking Library, Punctuation, Parts of Speech<br>*Math -- Numbers, Addition and Subtraction, Multiplication and Division, Geometry and Measurement, Fractions<br>*More -- Holiday Activities, Nursery Rhymes, Sing-Alongs, Interactive Calendar <br><br>*Why Starfall*<br><br>*Research based, teacher tested, child approved. Starfall&#39;s systematic approach was created by experienced educators using time-tested instructional methods.<br>*Try it for free. All of the basics for learning how to read are available to everyone.<br>*No advertisements. Whether a free user or subscriber, you won’t see any ads.<br>*Pass it forward! Subscribers gain access to hundreds of additional activities and support the free sections for others to enjoy.<br><br>*What people are saying about Starfall*<br><br>Listed on PC Magazine’s “15 best Online Learning Services for Kids,” Think Five’s “Top 5 Most Used Apps by Elementary Teachers,” and as one Parent&#39;s Magazine&#39;s &quot;70 Best Apps for Families.&quot;  <br><br>&quot;Kids can learn about letter recognition, phonics, and reading. Skill acquisition is appropriately gradual... Starfall does an excellent job of offering clear and intriguing early literacy lessons.&quot; —Common Sense Media<br><br>“I truly believe that Starfall set the foundation for my future.”<br>–Sarah, undergraduate at Stanford University<br><br>*Subscription information*<br><br>If you choose to purchase a Starfall subscription, a $5.99 (USD) payment will be applied to your Google Play account upon confirmation of purchase and monthly after that. Your subscription will automatically renew unless you cancel at least 24 hours before the end of the current period. This subscription is valid only for home use on devices signed in to your Google Play account. Google Play does not support Family Library or family payment methods for in-app subscription purchases.<br><br>*Additional Info*<br><br>This app requires an internet connection and is intended for Pre-K, Kindergarten, and Grades 1-5. It also supports English language development, special education, and homeschool environments.<br><br>Privacy Policy: https://teach.starfall.com/privacy<br>Terms of Service: https://teach.starfall.com/terms<br>About Starfall: https://teach.starfall.com/about<br>Starfall Education Foundation is a 501(c)(3) nonprofit organization.","Starfall","https://play.google.com/store/apps/details?id=air.com.starfall.more"
"com.prodigygame.prodigy","USD","Prodigy Education Inc.","true","https://play-lh.googleusercontent.com/9JDxAo3MvXqJPfKuM0OLpshV7GPD5KoQVwlm_RaKSrae83U1AtEo2UDbDXzazt1UCtA","0","4.7324953","4.7","education","Math practice used to be a struggle — but not anymore. Prodigy is a math game that’s loved by over a million teachers and 50 million students around the world, is using game-based learning to transform education. <br><br>Prodigy delivers a unique learning experience through an interactive math game where success depends on correctly answering skill-building math questions. Players can earn rewards, go on quests and play with friends — all while learning new skills! <br><br>We know that every student faces unique challenges when it comes to math learning. That’s why: <br>• Content is tailored to every player’s strengths and weaknesses <br>• Math questions are fully aligned with state-level curricula, including Common Core and TEKS, so Prodigy is always connected to the classroom. <br>• 1,400 available skills give students the chance to learn more and keep growing. <br><br>For a full list of the skills Prodigy supports, visit prodigygame.com/math/skills. <br><br>Are you a parent? Connect a free parent account today to: <br><br>•See what math practice your child is working on <br>•Monitor your child’s understanding and progress <br>•Set goals and give reward to encourage even more math practice! <br><br>To sign up for your free parent account, visit prodigygame.com. <br><br>&gt;&gt;Want your child to learn more?&lt;&lt; <br><br>You can use Prodigy to turn playtime into education time. Premium members level up faster, spend more time answering math questions and get exclusive access to pets, member-only game areas and extra rewards. To sign up today, visit prodigygame.com/membership. <br><br>To learn more about Prodigy and to get started, visit www.prodigygame.com. <br><br>One of the American Association of School Librarians’ Best Websites for Teaching and Learning 2018 <br>A 2018 Top Pick for Learning from Common Sense Education <br>iKeepSafe FERPA Certification <br>iKeepSafe COPPA Safe Harbor Certification","Prodigy Math: Kids Game","https://play.google.com/store/apps/details?id=com.prodigygame.prodigy"
"org.coursera.android","USD","Coursera, Inc.","true","https://play-lh.googleusercontent.com/GguSSKNcZdGw624xa9VqH71Sy6B12bHdlINY0RN_CltpzE51NgdFWkxesZuI4joVDrM","0","4.6829476","4.7","education","Start, switch, or advance your career with more than 8,000 courses, hands-on projects, certificate programs, and degrees. Coursera partners with world-class companies and universities, so that you can learn with experts and build the most job-relevant, in-demand skills.<br><br>WITH COURSERA YOU CAN:<br>• Learn job-relevant skills and industry-standard tools through hands-on projects<br>• Build knowledge for your career across a wide range of industry-tailored courses<br>• Get job-ready for an in-demand role through Professional Certificates<br>• Master a skill in a specific industry field with Specializations<br>• Advance your career with a bachelor’s or master’s degree<br><br>SO THAT YOU’LL BE ABLE TO:<br>• Grow your career with confidence<br>• Develop skills and credentials to stand out<br>• Enjoy flexibility and control over your career<br><br>WITH THE COURSERA APP YOU GET:<br>• Flexible schedules and on-demand courses<br>• Downloadable videos for offline viewing<br>• Audio-only supported courses, so you can learn when and where you want<br>• Mobile-friendly courses, so you can learn effectively on any device<br>• Saved coursework, quizzes and projects across your desktop and mobile devices<br>• Video subtitles for a variety of languages, including: Arabic, French, German, Indonesian, Japanese, Korean, Portuguese, Russian, Chinese, and Spanish<br><br>POPULAR COURSES:<br>• Computer Science: Programming, Mobile and Web Development, Python<br>• Data Science: Machine Learning, Probability and Statistics, Data Analysis<br>• Business: Finance, Marketing, Entrepreneurship, Business Strategy, E-commerce, UX, Design<br>• Information Technology: Cloud Computing, Support and Operations, Data Management, Security<br><br>PROFESSIONAL CERTIFICATE PROGRAMS:<br>• Front end developer, back-end developer, DevOps engineer<br>• Data analyst, data scientist, data engineer, data warehouse developer<br>• Project manager, UX designer, digital marketer, social media marketer, marketing analyst<br>• IT support specialist, application developer, Cybersecurity analyst<br>• Sales development representative, sales operations specialist bookkeeper, sales representative<br><br>DEGREE CATEGORIES:<br>• MBA and Business Degrees, Management Degrees<br>• Computer Science and Engineering, Data Science, and Data Analytics<br>• Social Science, Public Health<br><br>Get to Know Us: http://www.coursera.org<br>Privacy Policy: https://www.coursera.org/about/privacy<br>Terms of Service: https://www.coursera.org/about/terms","Coursera: Grow your career","https://play.google.com/store/apps/details?id=org.coursera.android"
"com.memrise.android.memrisecompanion","USD","Memrise","true","https://play-lh.googleusercontent.com/eooMtOtVjJzq7fCS4G--Iy3jY8QvFEzdsoWMcO5Z_mJOilep2Wu_aZLJjTP9SOF_9jU","0","4.480552","4.5","education","Over 75 million people have already chosen Memrise to achieve their language goals— make it your resolution this year! Whether it’s finally speaking Spanish, brushing up on French, or mastering Japanese, Memrise makes learning authentic, engaging, and unforgettable.<br><br>Start 2025 strong by picking up a new language and sticking to it! With real-life conversations, cultural insights, and the confidence to speak like a local, Memrise is your ultimate partner for turning your resolution into reality.<br><br>Learn Spanish, Korean, Japanese or 31 other languages in lessons that teach you vocabulary, listening and speaking as if you were a local living in the country!<br><br>Choose a language from Spanish 🇪🇸🇲🇽,  Korean 🇰🇷, Japanese 🇯🇵, English 🇬🇧🇺🇸, French 🇫🇷, Italian 🇮🇹, Portuguese 🇵🇹🇧🇷, German 🇩🇪, Polish 🇵🇱, Russian 🇷🇺, Turkish 🇹🇷, Arabic, Chinese 🇨🇳, Dutch 🇳🇱, Danish 🇩🇰, Icelandic 🇮🇸, Mongolian🇲🇳, Norwegian 🇳🇴, Slovenian 🇸🇮  Yoruba 🇳🇬 Hindi 🇮🇳 Ukranian 🇺🇦 Thai 🇹🇭 Swahili 🇹🇿🇰🇪, Hebrew 🇮🇱 Greek 🇬🇷 Indonesian 🇮🇩, Welsh 🏴󠁧󠁢󠁷󠁬󠁳󠁿, 🇵🇭 Tagalog, 🇮🇷Persian, 🇻🇳 Vietnamese. Also added: Yoruba, Hausa, and Somali!<br><br>Memrise is the ultimate language-learning app for achieving your New Year’s goals. Whether you’re a beginner starting from scratch, an intermediate learner building confidence in listening and speaking, or an advanced learner perfecting your conversational skills, Memrise has everything you need to succeed.<br><br>Download Memrise and make this year the one where you confidently:<br><br>❤️ Connect with your partner and their family <br>✈️ Have a better time while travelling <br>💡 Sharpen your mind if you’re learning a language for brain health<br>📖 Prepare for a language exam <br>💼 Connect with work colleagues <br>🎨 Better understand different cultures <br><br><b>How does Memrise help you learn Spanish, Korean, Japanese, and more?</b><br><br>-Choose from hundreds of lessons inspired by real-life scenarios to keep learning practical and relevant.<br>-Build your vocabulary with essential words and phrases locals actually use.<br>-Practice listening with thousands of videos featuring native speakers in everyday settings.<br>-Gain confidence speaking with AI Buddies: personalised language-learning bots. Practice sentence-building, grammar, conjugation, and all the essential skills to sound fluent in your new language.<br><br>😎 Tailored to your language level ability <br>💪 Challenging but not overwhelming <br><br>⭐ Helping 75+ million learners speak confidently <br>⭐ 190,00 4.6 star ratings <br>⭐ Featured in BBC World Service, Conde Nast Traveller, Lonely Planet and more.<br><br><b>What other learners are saying</b> <br><br>★★★★★ <i>&quot;I&#39;ve been using Memrise for about two years, studying European Portuguese. I have the paid version - it&#39;s a solid learning tool, and it has been my primary resource ever since got it. I find the Learn with Locals feature to be especially useful, more so as my Portuguese improves. My wife and I spent a couple of weeks in Portugal a few months ago, and we were able to handle all of our transactions - stores, restaurants, markets, car rental, etc!&quot;</i> -Voloúre <br><br><b> Need to speak a new language soon? Get the practice you need with Memrise Pro </b> <br><br>Memrise Pro ✓ Unlock all vocab lessons ✓ Unlock all native speaker videos ✓ Unlimited speaking practice ✓ Ad free <br><br>Compare with our Free Plan - Limited vocab lessons - Limited videos and conversations ✕ Ad free <br><br>*PLEASE READ: A Memrise Pro subscription is required in to access all learning features. These vary depending on your device&#39;s language and language pair. Once purchased, subscriptions will automatically renew unless cancelled before the end of the current payment period. Subscriptions can be managed in your Google Play Store account. To enable some features of the Memrise app we may need to ask for your permission. You can change permissions at any time in your settings. <br><br>Privacy Policy: https://www.memrise.com/privacy/ <br>Terms of Use: https://www.memrise.com/terms/safa","Memrise: Languages for life","https://play.google.com/store/apps/details?id=com.memrise.android.memrisecompanion"
